title;imdb;mid;trailer;date;directors;actors;poster;netflix_id;runtime;rating;descr;Action;Adventure;Animation;Comedy;Drama;Family;Fantasy;Mystery;Romance;Science Fiction;Thriller;class1;class2;class3
Django Unchained;tt1853728;;http://video-http.media-imdb.com/MV5BNzg4NjYzMjgyN15BMTFeQW1wNF5BbWU3MDA1NTU5Nzg@.mp4?Expires=1422401921&Signature=3CqmJMXk4QAOurAIaMxfsDSjeGXoh52JyR2mIkvsPS1Pq11uHl4pV5EmQyRJwkzRwguRFdlM7LQxvqMWH0fE65fWS3Xmt6nVnJ2y8NvpasFt-jJ5hebNJFY~TqJr8imweNAAbXnV3dLCBRVMcjQwvcnoGt2Uwb~t~xyQyv6f6Jw_&Key-Pair-Id=APKAILW5I44IHKUN2DYA;2012;Quentin Tarantino;Jamie Foxx, Christoph Waltz, Leonardo DiCaprio, Kerry Washington;http://ia.media-imdb.com/images/M/MV5BMjIyNTQ5NjQ1OV5BMl5BanBnXkFtZTcwODg1MDU4OA@@._V1_.jpg;;165;8.5;With the help of a German bounty hunter, a freed slave sets out to rescue his wife from a brutal Mississippi plantation owner.;0;0;0;0;0;0;0;0;0;0;0;0;0;0
Dog Day Afternoon;tt0072890;;http://www.totaleclips.com/Player/Bounce.aspx?eclipid=e62895&bitrateid=472&vendorid=102&type=.mp4;1975;Sidney Lumet;Penelope Allen, Sully Boyar, John Cazale, Beulah Garrick;http://ia.media-imdb.com/images/M/MV5BMTQyNjQ5NjczM15BMl5BanBnXkFtZTYwNDA4MTk4._V1_.jpg;450423;125;8.1;"A man robs a bank to pay for his lover's operation; it turns into a hostage situation and a media circus.";0;0;0;0;1;0;0;0;0;0;0;0;0.31;0
Dog Pound;tt1422020;/m/0g5b48z;[];24/04/2010;Kim Chapiron;Adam Butcher, Shane Kippel, Mateo Morales, Slim Twig;http://ia.media-imdb.com/images/M/MV5BMTM0NDY2ODEzNF5BMl5BanBnXkFtZTcwNTcxMDg2Mw@@._V1_SX300.jpg;['70136048'];91;8.1;Three juvenile delinquents are sentenced to a correctional facility where they encounter gang violence, death, and harassment from staff and other inmates.;0;0;0;0;1;0;0;0;0;0;1;0;0.318181818;0
Dogville;tt0276919;/m/023g6w;['http://www.youtube.com/watch?v=h63WPetiulA', 'http://www.imdb.com/video/screenplay/vi178454809/'];19/05/2003;Lars von Trier;Nicole Kidman, Harriet Andersson, Lauren Bacall, Jean-Marc Barr;http://ia.media-imdb.com/images/M/MV5BMTkwNTg2MTI1NF5BMl5BanBnXkFtZTcwMDM1MzUyMQ@@._V1_SX300.jpg;['60034546'];178;7;A woman on the run from the mob is reluctantly accepted in a small Colorado town. In exchange, she agrees to work for them. As a search visits town, she finds out that their support has a price. Yet her dangerous secret is never far away...;0;0;0;0;1;0;0;0;0;0;0;0;0.306818182;0
Domino;tt0421054;/m/04g9gd;['http://www.youtube.com/watch?v=nWoOBAc532o'];25/09/2005;Tony Scott;Keira Knightley, Mickey Rourke, Édgar Ramírez, Delroy Lindo;http://ia.media-imdb.com/images/M/MV5BMTkwOTA5Njc4Ml5BMl5BanBnXkFtZTcwNzg0MzEzMQ@@._V1_SX300.jpg;['70028901'];127;5.5;A recounting of Domino Harvey's life story. The daughter of actor Laurence Harvey turned away from her career as a Ford model to become a bounty hunter.;1;1;0;1;1;0;0;0;0;0;1;0.495726496;0.835227273;0.514644351
Donnie Darko;tt0246578;;http://www.totaleclips.com/Player/Bounce.aspx?eclipid=e23473&bitrateid=472&vendorid=102&type=.mp4;2001;Richard Kelly;Jake Gyllenhaal, Holmes Osborne, Maggie Gyllenhaal, Daveigh Chase;http://ia.media-imdb.com/images/M/MV5BMTczMzE4Nzk3N15BMl5BanBnXkFtZTcwNDg5Mjc4NA@@._V1_.jpg;60022315;113;8.1;A troubled teenager is plagued by visions of a large bunny rabbit that manipulates him to commit a series of crimes, after narrowly escaping a bizarre accident.;0;0;0;0;1;0;0;1;0;1;0;0.03;0.33;0.1
Double Indemnity;tt0036775;;http://www.totaleclips.com/Player/Bounce.aspx?eclipid=e111534&bitrateid=472&vendorid=102&type=.mp4;1944;Billy Wilder;Fred MacMurray, Barbara Stanwyck, Edward G. Robinson, Porter Hall;http://ia.media-imdb.com/images/M/MV5BMTQzOTE4MTIzMV5BMl5BanBnXkFtZTgwODc1NDQ5MDE@._V1_.jpg;60030178;107;8.4;An insurance representative lets himself be talked into a murder/insurance fraud scheme that arouses an insurance investigator's suspicions.;0;0;0;0;1;0;0;0;0;0;1;0;0.32;0
Downfall;tt0363163;;;2004;Oliver Hirschbiegel;Bruno Ganz, Alexandra Maria Lara, Corinna Harfouch, Ulrich Matthes;http://ia.media-imdb.com/images/M/MV5BMTM1OTI1MjE2Nl5BMl5BanBnXkFtZTcwMTEwMzc4NA@@._V1_.jpg;70023508;156;8.3;Traudl Junge, the final secretary for Adolf Hitler, tells of the Nazi dictator's final days in his Berlin bunker at the end of WWII.;0;0;0;0;1;0;0;0;0;0;0;0;0.31;0
Dr. Strangelove or: How I Learned to Stop Worrying and Love the Bomb;tt0057012;;http://www.totaleclips.com/Player/Bounce.aspx?eclipid=e11930&bitrateid=471&vendorid=102&type=.mp4;1964;Stanley Kubrick;Peter Sellers, George C. Scott, Sterling Hayden, Keenan Wynn;http://ia.media-imdb.com/images/M/MV5BMTU2ODM2NTkxNF5BMl5BanBnXkFtZTcwOTMwMzU3Mg@@._V1_.jpg;60020009;95;8.5;An insane general triggers a path to nuclear holocaust that a war room full of politicians and generals frantically try to stop.;0;0;0;1;0;0;0;0;0;1;0;0.18;0.59;0.07
Dracula;tt0021814;/m/04193s;[];12/02/1931;Tod Browning, Karl Freund;Bela Lugosi, Helen Chandler, David Manners, Dwight Frye;http://ia.media-imdb.com/images/M/MV5BNTg5NjkxMjUxNF5BMl5BanBnXkFtZTgwNzk1NDc2MTE@._V1_SX300.jpg;['22495228'];85;5.9;The ancient vampire Count Dracula arrives in England and begins to prey upon the virtuous young Mina.;0;0;0;0;0;0;1;0;0;0;0;0.107692308;0;0
Dragon Eyes;tt1735862;/m/0gj8k8t;[];2011;John Hyams;Cung Le, Jean-Claude Van Damme, Johnny Holmes, Peter Weller;http://ia.media-imdb.com/images/M/MV5BMTM2Njk1Nzc1NF5BMl5BanBnXkFtZTcwNjc0NDQ4Nw@@._V1_SX300.jpg;['70241238'];101;4.1;In St. Jude, drug dealers and corrupt cops have destroyed an urban neighborhood. But newcomer, Hong, has the fighting skills and moral vision to save this town from itself.;1;0;0;0;1;0;0;0;0;0;1;0.061538462;0.329545455;0
Drive;tt0780504;/m/0g4vmj8;['http://www.youtube.com/watch?v=sY1TLgqfjvw'];20/05/2011;Nicolas Winding Refn;Ryan Gosling, Carey Mulligan, Bryan Cranston, Albert Brooks;http://ia.media-imdb.com/images/M/MV5BOTM1ODQ0Nzc4NF5BMl5BanBnXkFtZTcwMTM0MjQyNg@@._V1_SX300.jpg;['70189289'];100;8;A mysterious Hollywood stuntman, mechanic and getaway driver lands himself in trouble when he helps out his neighbor.;1;0;0;0;1;0;0;0;0;0;1;0.061538462;0.329545455;0
Easy Money;tt0085470;/m/0f1v1q;[];19/08/1983;James Signorelli;Rodney Dangerfield, Joe Pesci, Geraldine Fitzgerald, Candice Azzara;http://ia.media-imdb.com/images/M/MV5BMjA5MDE0MjE5Ml5BMl5BanBnXkFtZTcwMjY3NjYzNA@@._V1_SX300.jpg;['70018000'];95;5.5;To inherit his mother-in-law's colossal fortune, a hard living, gambling addict must change his unhealthy ways before it gets the best of him.;0;0;0;1;0;0;0;0;0;0;0;0;0.585227273;0
Eden;tt1020950;/m/04nlb9l;[];25/04/2008;Declan Recks;Aidan Kelly, Eileen Walsh, Padraic Delaney, Karl Shiels;http://ia.media-imdb.com/images/M/MV5BMTc0ODk2NjQ0MV5BMl5BanBnXkFtZTcwNDI1NzgxMw@@._V1_SX300.jpg;['70099624'];83;6.1;A married couple's relationship begins to fall apart as their 10th wedding anniversary approaches.;0;0;0;0;1;0;0;0;0;0;0;0;0.306818182;0
Elvis and Anabelle;tt0787462;/m/02pm46t;[];2007;Will Geiger;Max Minghella, Blake Lively, Joe Mantegna, Mary Steenburgen;http://ia.media-imdb.com/images/M/MV5BMTkxNTk5OTg1MV5BMl5BanBnXkFtZTcwNTk5MzM0MQ@@._V1_SX300.jpg;['70139476'];106;7;Groomed by her overly ambitious mother, Anabelle is on the road to winning the Miss Texas Rose tiara when she dies tragically during a pageant. Her death lands her on the embalming table of...;0;0;0;0;1;0;0;0;1;0;0;0;0.340909091;0
Empire;tt0262396;/m/0690t3;[];2002;Franc. Reyes;John Leguizamo, Peter Sarsgaard, Denise Richards, Vincent Laresca;http://ia.media-imdb.com/images/M/MV5BMTQ1OTc4NzgzN15BMl5BanBnXkFtZTYwNTM0MDg5._V1_SX300.jpg;['60025570'];90;5.5;A successful South Bronx drug dealer turns his back on his roots and gives money to a Wall Street broker to invest for him.;0;0;0;0;1;0;0;0;0;0;1;0;0.318181818;0
Endhiran;tt1305797;/m/02w86hz;['http://www.youtube.com/watch?v=hNXHveyzUvY'];30/09/2010;S. Shankar;Rajinikanth, Aishwarya Rai Bachchan, Danny Denzongpa, Santhanam;http://ia.media-imdb.com/images/M/MV5BMTMzMDE2MDg0N15BMl5BanBnXkFtZTcwNTc0Nzg5Mw@@._V1_SX300.jpg;['70154112'];185;6.7;An human-android constructed by a scientist falls in love with the to-be bride of his creator.;1;1;0;1;0;0;1;0;1;1;0;0.823931624;0.670454545;0.652719665
Enigma;tt0157583;/m/04lg07;[];22/01/2001;Michael Apted;Dougray Scott, Kate Winslet, Saffron Burrows, Jeremy Northam;http://ia.media-imdb.com/images/M/MV5BMjAyMTg3Nzc3N15BMl5BanBnXkFtZTcwOTU3MDMyMQ@@._V1_SX300.jpg;['60022941'];119;5.2;A young genius frantically races against time to crack an enemy code and solve the mystery surrounding the woman he loves.;0;0;0;0;1;0;0;1;1;0;1;0.087179487;0.471590909;0.552301255
Equilibrium;tt0238380;/m/01j2ff;[];06/12/2002;Kurt Wimmer;Christian Bale, Dominic Purcell, Sean Bean, Christian Kahrmann;http://ia.media-imdb.com/images/M/MV5BMTkzMzA1OTI3N15BMl5BanBnXkFtZTYwMzUyMDg5._V1_SX300.jpg;['60024935'];107;7.2;In a Fascist future where all forms of feeling are illegal, a man in charge of enforcing the law rises to overthrow the system.;1;0;0;0;1;0;0;0;0;1;1;0.285470085;0.340909091;0.087866109
Essential Killing;tt1561768;/m/0cm9yqs;['http://www.youtube.com/watch?v=_0CR2N4xbfQ&feature=player_embedded'];06/09/2010;Jerzy Skolimowski;Vincent Gallo, Emmanuelle Seigner, Zach Cohen, Iftach Ophir;http://ia.media-imdb.com/images/M/MV5BNTE5NjAxMTEzNl5BMl5BanBnXkFtZTcwMjYzMDQ0Ng@@._V1_SX300.jpg;['70153930'];83;5.3;An Afghan POW attempts his escape.;1;0;0;0;1;0;0;0;0;0;1;0.061538462;0.329545455;0
Eternal Sunshine of the Spotless Mind;tt0338013;/m/02mt51;['http://www.youtube.com/watch?v=1GiLxkDK8sI&feature=player_detailpage'];19/03/2004;Michel Gondry;Jim Carrey, Kate Winslet, Gerry Robert Byrne, Elijah Wood;http://ia.media-imdb.com/images/M/MV5BMTY4NzcwODg3Nl5BMl5BanBnXkFtZTcwNTEwOTMyMw@@._V1_SX300.jpg;['60034545'];108;8.5;When their relationship turns sour, a couple undergoes a procedure to have each other erased from their memories. But it is only through the process of loss that they discover what they had to begin with.;0;0;0;0;1;0;0;0;1;1;0;0.020512821;0.380681818;0.016736402
Everywhere and Nowhere;tt1673374;/m/0glpxs0;[];06/05/2011;Menhaj Huda;James Floyd, Adam Deacon, Alyy Khan, Shivani Ghai;http://ia.media-imdb.com/images/M/MV5BMTY5NzI5NDk3NF5BMl5BanBnXkFtZTcwMDIyMDU5NA@@._V1_SX300.jpg;[];96;5.3;A drama centered on a British Asian torn between honoring his family traditions and his love for DJing.;0;0;0;0;1;0;0;0;0;0;0;0;0.306818182;0
Exodus;tt0053804;/m/04tng0;['http://www.youtube.com/watch?v=6gmBfWDW9tU'];15/12/1960;Otto Preminger;Paul Newman, Eva Marie Saint, Ralph Richardson, Peter Lawford;http://ia.media-imdb.com/images/M/MV5BMTk4NjMxNjcyOV5BMl5BanBnXkFtZTgwNDAwNTIxMDE@._V1_SX300.jpg;['60010331'];208;6.1;The theme is the founding of the state of Israel. The action begins on a ship filled with Jewish immigrants bound for Israel who are being off loaded on Cyprus. An Intelligence officer ...;1;0;0;0;1;0;0;0;0;0;0;0.01025641;0.318181818;0
Fanny and Alexander;tt0083922;;;1982;Ingmar Bergman;Kristina Adolphson, Börje Ahlstedt, Pernilla Allwin, Kristian Almgren;http://ia.media-imdb.com/images/M/MV5BOTUyODUwNjc0NV5BMl5BanBnXkFtZTcwMTk0MTcyMQ@@._V1_.jpg;60010336;188;8.2;Two young Swedish children experience the many comedies and tragedies of their family, the Ekdahls.;0;0;0;0;1;0;0;0;0;0;0;0;0.31;0
Fanny Hill;tt0087237;/m/0bwhvqb;[];15/07/1983;Gerry O'Hara;Lisa Foster, Oliver Reed, Wilfrid Hyde-White, Shelley Winters;http://ia.media-imdb.com/images/M/MV5BMTk5MTkzMDM1NV5BMl5BanBnXkFtZTcwMzk5NjUyMQ@@._V1_SX300.jpg;['70039381'];98;6;Happily engaged to her handsome fiance, Charles, Fanny is soon hit with one misfortune after another until she is forced to become a prostitute to survive. This is the story, with many ...;0;0;0;1;1;0;0;0;1;0;0;0.032478632;0.988636364;0
Fargo;tt0116282;;http://www.totaleclips.com/Player/Bounce.aspx?eclipid=e71791&bitrateid=471&vendorid=102&type=.mp4;1996;Joel Coen, Ethan Coen;William H. Macy, Steve Buscemi, Peter Stormare, Kristin Rudrüd;http://ia.media-imdb.com/images/M/MV5BMTgxNzY3MzUxOV5BMl5BanBnXkFtZTcwMDA0NjMyNA@@._V1_.jpg;493387;98;8.2;Jerry Lundegaard's inept crime falls apart due to his and his henchmen's bungling and the persistent police work of the quite pregnant Marge Gunderson.;0;0;0;0;1;0;0;0;0;0;1;0;0.32;0
Fast Food Nation;tt0460792;/m/0gbfn9;['http://www.youtube.com/watch?v=Q5hA3PN0uic'];19/05/2006;Richard Linklater;Wilmer Valderrama, Catalina Sandino Moreno, Ana Claudia Talancón, Juan Carlos Serrán;http://ia.media-imdb.com/images/M/MV5BNTU2Mzc3ODc3N15BMl5BanBnXkFtZTYwOTI5NDM3._V1_SX300.jpg;['70042798'];116;5;An ensemble piece examining the health risks involved in the fast food industry and its environmental and social consequences as well.;0;0;0;1;1;0;0;0;1;0;0;0.032478632;0.988636364;0
Fast Girls;tt1700808;/m/0j27_r4;['http://www.imdb.com/video/imdb/vi2851971097/'];15/06/2012;Regan Hall;Lenora Crichlow, Philip Davis, Jamie Howard, Jahvel Hall;http://ia.media-imdb.com/images/M/MV5BMTgzNzY2NzAyNl5BMl5BanBnXkFtZTcwMzI3NDM5Nw@@._V1_SX300.jpg;[];110;7;A street smart runner develops an intense rivalry with an equally ambitious wealthy young athlete.;0;0;0;0;1;0;0;0;0;0;0;0;0.306818182;0
Faster;tt1433108;/m/07zkkck;[];24/11/2010;George Tillman Jr.;Dwayne Johnson, Mauricio Lopez, Jim Gaines, Tom Berenger;http://ia.media-imdb.com/images/M/MV5BMTMyOTQ5MTAxOF5BMl5BanBnXkFtZTcwOTYzMDg5Mw@@._V1_SX300.jpg;['70140907'];98;5.8;An ex-con sets out to avenge his brother's death after they were double-crossed during a heist years ago. During his campaign, however, he's tracked by a veteran cop and an egocentric hit man.;1;0;0;0;1;0;0;0;0;0;1;0.061538462;0.329545455;0
Felon;tt1117385;/m/04f52y4;[];2008;Ric Roman Waugh;Stephen Dorff, Marisol Nichols, Vincent Miller, Anne Archer;http://ia.media-imdb.com/images/M/MV5BMTA5NzE1ODk4OTJeQTJeQWpwZ15BbWU3MDI5NzE0ODE@._V1_SX300.jpg;['70102746'];104;7.8;A family man convicted of killing an intruder must cope with life afterward in the violent penal system.;1;0;0;0;1;0;0;0;0;0;1;0.061538462;0.329545455;0
Femme Fatale;tt0280665;/m/07n90q;[];30/04/2002;Brian De Palma;Rebecca Romijn, Antonio Banderas, Peter Coyote, Eriq Ebouaney;http://ia.media-imdb.com/images/M/MV5BMTczMjc2MjA2OV5BMl5BanBnXkFtZTYwMjAwNDk5._V1_SX300.jpg;['60024923'];114;3.8;A woman tries to straighten out her life, even as her past as a con-woman comes back to haunt her.;0;0;0;0;0;0;0;1;0;0;1;0.008547009;0;0.912133891
Fight Club;tt0137523;;http://www.totaleclips.com/Player/Bounce.aspx?eclipid=e61676&bitrateid=472&vendorid=102&type=.mp4;1999;David Fincher;Edward Norton, Brad Pitt, Helena Bonham Carter, Meat Loaf;http://ia.media-imdb.com/images/M/MV5BMjIwNTYzMzE1M15BMl5BanBnXkFtZTcwOTE5Mzg3OA@@._V1_.jpg;60020012;139;8.9;An insomniac office worker looking for a way to change his life crosses paths with a devil-may-care soap maker and they form an underground fight club that evolves into something much, much more...;0;0;0;0;1;0;0;0;0;0;0;0;0.31;0
Finding Nemo;tt0266543;;http://video-http.media-imdb.com/MV5BMjE3ODI4NDgzMF5BMTFeQW1wNF5BbWU3MDY5OTE0ODc@.mp4?Expires=1422396543&Signature=BUUtr~UGc1rHrfsMJIy134S~3Fsq6MPG8EiHQAY4Ms8TNUMa8iF5GUEg8gP38GFLXVaSeUnHQGBL2Cl~Yh4KhwhKCf8dfgn-mU8vbHZhd72PD2Ga1FqCjQ0T7H08koYhZwTgA9luAP3ik7Q9lxgQeYa89k4NP2mSHHnrEwKsfHA_&Key-Pair-Id=APKAILW5I44IHKUN2DYA;2003;Andrew Stanton, Lee Unkrich;Albert Brooks, Ellen DeGeneres, Alexander Gould, Willem Dafoe;http://ia.media-imdb.com/images/M/MV5BMTY1MTg1NDAxOV5BMl5BanBnXkFtZTcwMjg1MDI5Nw@@._V1_.jpg;60030108;100;8.2;After his son is captured in the Great Barrier Reef and taken to Sydney, a timid clownfish sets out on a journey to bring him home.;0;1;1;1;0;1;0;0;0;0;0;0.84;0.63;0.06
First Love;tt0396818;/m/03cx55t;['http://www.mymovies.it/trailer/?id=34933'];09/02/2004;Matteo Garrone;Vitaliano Trevisan, Michela Cescon, Elvezia Allari, Paolo Capoduro;http://ia.media-imdb.com/images/M/MV5BMTUwOTY5NTc1M15BMl5BanBnXkFtZTcwMDMxNTA0MQ@@._V1_SX300.jpg;['70032564'];94;6.8;Vittorio is looking for a woman who matches his ideal. Through a classified ad he meets Sonia, a sweet, pleasant, intelligent girl. However, she weighs 125 pounds -- which according to ...;0;0;0;0;1;0;0;0;1;0;0;0;0.340909091;0
Fish Tank;tt1232776;/m/05z_kps;[];14/05/2009;Andrea Arnold;Katie Jarvis, Michael Fassbender, Kierston Wareing, Rebecca Griffiths;http://ia.media-imdb.com/images/M/MV5BMTc1NTk4MzkxOF5BMl5BanBnXkFtZTcwNDkxMDAxMw@@._V1_SX300.jpg;['70118769'];123;7.3;Everything changes for 15-year-old Mia when her mum brings home a new boyfriend.;0;0;0;0;1;0;0;0;0;0;0;0;0.306818182;0
Foolproof;tt0356614;/m/09w4w7;[];03/10/2003;William Phillips;Ryan Reynolds, Kristin Booth, Joris Jarsky, Sean Sullivan;http://ia.media-imdb.com/images/M/MV5BMTQ3NjQxMTkxMV5BMl5BanBnXkFtZTcwNTU5MDUyMQ@@._V1_SX300.jpg;['60034333'];94;6.8;Kevin, Sam and Rob are founding members of a theoretical group which pulls off heists. Leo, a gangster, blackmails them into pulling off a real multi-million dollar heist. Now it's up to them to get out alive.;1;0;0;1;0;0;0;0;0;0;1;0.229059829;0.596590909;0.205020921
Footloose;tt1068242;/m/080nwsb;['http://youtu.be/79DcKuxmXMs'];06/10/2011;Craig Brewer;Kenny Wormald, Julianne Hough, Dennis Quaid, Andie MacDowell;http://ia.media-imdb.com/images/M/MV5BMTY3MjIzMjk4M15BMl5BanBnXkFtZTcwMzMxMzIzNg@@._V1_SX300.jpg;['70178624'];113;6.9;City teenager Ren MacCormack moves to a small town where rock music and dancing have been banned, and his rebellious spirit shakes up the populace.;0;0;0;1;1;0;0;0;1;0;0;0.032478632;0.988636364;0
For a Few Dollars More;tt0059578;;;1965;Sergio Leone;Clint Eastwood, Lee Van Cleef, Gian Maria Volonté, Mario Brega;http://ia.media-imdb.com/images/M/MV5BMTQzMjIzOTEzMF5BMl5BanBnXkFtZTcwMTUzNTk3NA@@._V1_.jpg;11519851;132;8.3;Two bounty hunters with the same intentions, team up to track down a Western outlaw.;1;1;0;0;0;0;0;0;0;0;0;0.22;0;0
Forrest Gump;tt0109830;;http://www.totaleclips.com/Player/Bounce.aspx?eclipid=e10788&bitrateid=471&vendorid=102&type=.mp4;1994;Robert Zemeckis;Tom Hanks, Rebecca Williams, Sally Field, Michael Conner Humphreys;http://ia.media-imdb.com/images/M/MV5BMTQwMTA5MzI1MF5BMl5BanBnXkFtZTcwMzY5Mzg3OA@@._V1_.jpg;60000724;142;8.8;Forrest Gump, while not intelligent, has accidentally been present at many historic moments, but his true love, Jenny Curran, eludes him.;0;0;0;1;1;0;0;0;1;0;0;0.02;0.98;0
Frankenstein;tt0021884;/m/0jqzt;['http://www.youtube.com/watch?v=McUce_xwxeA'];21/11/1931;James Whale;Colin Clive, Mae Clarke, John Boles, Boris Karloff;http://ia.media-imdb.com/images/M/MV5BMTkyOTg5NTE1Nl5BMl5BanBnXkFtZTgwMDY2NTUyMjE@._V1_SX300.jpg;['70012479', '70064263'];70;5.5;An obsessed scientist assembles a living being from parts of exhumed corpses.;0;0;0;0;0;0;0;0;0;1;0;0.136752137;0.005681818;0.066945607
Frankenweenie;tt1142977;/m/0g56t9t;['http://www.imdb.com/video/imdb/vi23568665/'];20/09/2012;Tim Burton;Catherine O'Hara, Martin Short, Martin Landau, Charlie Tahan;http://ia.media-imdb.com/images/M/MV5BMTk1MjYzMjY2N15BMl5BanBnXkFtZTgwNzg2NjAwMzE@._V1_SX300.jpg;[];112;8.1;Young Victor conducts a science experiment to bring his beloved dog Sparky back to life, only to face unintended, sometimes monstrous, consequences.;0;0;1;1;0;1;0;0;0;1;0;0.61025641;0.397727273;0.071129707
Free Zone;tt0441761;/m/06z3xb;[];19/05/2005;Amos Gitai;Natalie Portman, Hana Laszlo, Hiam Abbass, Carmen Maura;http://ia.media-imdb.com/images/M/MV5BMTQ0Nzc2Mzk3OF5BMl5BanBnXkFtZTcwMTM1NDY0MQ@@._V1_SX300.jpg;['70035175'];90;4.7;Two women embark on a road trip after they are brought together by circumstance. Rebecca (Portman) flees her hotel after a fight with her mother-in-law (Maura) and hails a taxi driven by Hanna (Lazlo).;0;0;0;1;1;0;0;0;0;0;0;0;0.659090909;0
Freeze Frame;tt0363095;/m/0drn2t;[];2004;John Simpson;Lee Evans, Sean McGinley, Ian McNeice, Colin Salmon;http://ia.media-imdb.com/images/M/MV5BMTU3NjkzNzQ0Nl5BMl5BanBnXkFtZTcwMTc1MzMzMQ@@._V1_SX300.jpg;['70012744'];99;6.4;Ten years ago, after being accused of a hideous murder of a mother and her twin daughters, Sean Veil became paranoid, filming himself along twenty-four hours a day to have an alibi if ...;0;0;0;0;0;0;0;1;0;0;1;0.008547009;0;0.912133891
Frida;tt0120679;/m/02jxrw;[];29/08/2002;Julie Taymor;Salma Hayek, Mía Maestro, Alfred Molina, Antonio Banderas;http://ia.media-imdb.com/images/M/MV5BMTMyODUyMDY1OV5BMl5BanBnXkFtZTYwMDA2OTU3._V1_SX300.jpg;['60024997'];123;7.5;A biography of artist Frida Kahlo, who channeled the pain of a crippling injury and her tempestuous marriage into her work.;0;0;0;0;1;0;0;0;1;0;0;0;0.340909091;0
Friday After Next;tt0293815;/m/06x8g2;[];22/11/2002;Marcus Raboy;Ice Cube, Mike Epps, John Witherspoon, Don 'D.C.' Curry;http://ia.media-imdb.com/images/M/MV5BMTM3ODkwODM3OF5BMl5BanBnXkFtZTYwNjUzMDg5._V1_SX300.jpg;['60024929'];85;6.5;Craig and Day Day have finally moved out of their parents houses and into their own crib. The cousins work nights at a local mall as security guards. When their house is robbed on Christmas...;0;0;0;1;0;0;0;0;0;0;0;0;0.585227273;0
Friday Night Lights;tt0390022;/m/042zrm;[];06/10/2004;Peter Berg;Billy Bob Thornton, Lucas Black, Garrett Hedlund, Derek Luke;http://ia.media-imdb.com/images/M/MV5BMTcxMDI5MTM4Ml5BMl5BanBnXkFtZTcwNjA4MDcyMQ@@._V1_SX300.jpg;['70002003'];118;7.4;Based on H.G. Bissinger's book, which profiled the economically depressed town of Odessa, Texas and their heroic high school football team, The Permian High Panthers.;1;0;0;0;1;0;0;0;0;0;0;0.01025641;0.318181818;0
Fright Night;tt0089175;/m/04857z;[];02/08/1985;Tom Holland;Chris Sarandon, William Ragsdale, Amanda Bearse, Roddy McDowall;http://ia.media-imdb.com/images/M/MV5BMTkxNzA2NjUyOF5BMl5BanBnXkFtZTgwMzQzNTcxMTE@._V1_SX300.jpg;['525692'];106;5.7;When a teenager learns that his next door neighbour is a vampire, no one will believe him.;0;0;0;1;0;0;0;0;0;0;1;0.001709402;0.590909091;0.066945607
From Hell;tt0120681;/m/0c34mt;[];08/09/2001;Albert Hughes, Allen Hughes;Johnny Depp, Heather Graham, Ian Holm, Robbie Coltrane;http://ia.media-imdb.com/images/M/MV5BMTM1MjkxNTQxMV5BMl5BanBnXkFtZTYwMDMxNDg2._V1_SX300.jpg;['60021642'];122;6.9;In Victorian Era London, a troubled clairvoyant police detective investigates the murders by Jack The Ripper.;0;0;0;0;1;0;0;1;0;0;1;0.001709402;0.329545455;0.39748954
From Paris with Love;tt1179034;/m/04ydyvx;[];04/02/2010;Pierre Morel;John Travolta, Jonathan Rhys Meyers, Kasia Smutniak, Richard Durden;http://ia.media-imdb.com/images/M/MV5BNDUyMzExOTAyM15BMl5BanBnXkFtZTcwMTU0NjAyMw@@._V1_SX300.jpg;['70117322'];92;5.1;In Paris, a young employee in the office of the US Ambassador hooks up with an American spy looking to stop a terrorist attack in the city.;1;0;0;0;0;0;0;0;0;0;1;0.295726496;0;0.694560669
From Prada to Nada;tt0893412;/m/0crst3q;[];28/01/2011;Angel Gracia;Camilla Belle, Alexa PenaVega, Tina French, Luis Rosales;http://ia.media-imdb.com/images/M/MV5BMTY2NDAxNjgwMF5BMl5BanBnXkFtZTcwNDc3NzQxNA@@._V1_SX300.jpg;['70139385'];107;5.5;"A Latina spin on Jane Austen's ""Sense and Sensibility,"" where two spoiled sisters who have been left penniless after their father's sudden death are forced to move in with their estranged aunt in East Los Angeles.";0;0;0;1;1;0;0;0;1;0;0;0.032478632;0.988636364;0
Frozen;tt1323045;/m/09k68nd;[];24/01/2010;Adam Green;Emma Bell, Shawn Ashmore, Kevin Zegers, Ed Ackerman;http://ia.media-imdb.com/images/M/MV5BMTc5MTg0ODgxMF5BMl5BanBnXkFtZTcwODEzOTYwMw@@._V1_SX300.jpg;['70129461'];93;6.2;Three skiers stranded on a chairlift are forced to make life-or-death choices which prove more perilous than staying put and freezing to death.;0;0;0;0;1;0;0;0;0;0;1;0;0.318181818;0
Frozen River;tt0978759;/m/03gyr36;['http://www.youtube.com/watch?v=B5pPQdLN4mg'];18/01/2008;Courtney Hunt;Melissa Leo, Misty Upham, Charlie McDermott, Michael O'Keefe;http://ia.media-imdb.com/images/M/MV5BMTk2NjMwMDgzNF5BMl5BanBnXkFtZTcwMDY0NDY3MQ@@._V1_SX300.jpg;['70084148'];97;6.9;Takes place in the days before Christmas near a little-known border crossing on the Mohawk reservation between New York State and Quebec. Here, the lure of fast money from smuggling ...;0;0;0;0;1;0;0;0;0;0;0;0;0.306818182;0
Fugitive Pieces;tt0765451;/m/04j03kw;[];06/09/2007;Jeremy Podeswa;Robbie Kay, Monika Schurmann, Nina Dobrev, Jordan Pettle;http://ia.media-imdb.com/images/M/MV5BODU3MzU3MzQyMV5BMl5BanBnXkFtZTcwMzMyNzg2MQ@@._V1_SX300.jpg;['70098624'];104;6.3;A child escapes from Poland during World War II and first heads to Greece before coming of age in Canada.;0;0;0;0;1;0;0;0;0;0;0;0;0.306818182;0
Full Metal Jacket;tt0093058;;;1987;Stanley Kubrick;Matthew Modine, Adam Baldwin, Vincent D'Onofrio, R. Lee Ermey;http://ia.media-imdb.com/images/M/MV5BMjA4NzY4ODk4Nl5BMl5BanBnXkFtZTgwOTcxNTYxMTE@._V1_.jpg;528677;116;8.4;A pragmatic U.S. Marine observes the dehumanizing effects the U.S.-Vietnam War has on his fellow recruits from their brutal boot camp training to the bloody street fighting in Hue.;1;0;0;0;1;0;0;0;0;0;0;0.01;0.34;0
Funkytown;tt0981286;/m/0gg6d3h;['http://www.youtube.com/watch?v=J_X-eRpJsoM'];28/01/2011;Daniel Roby;Patrick Huard, Justin Chatwin, Paul Doucet, Sarah Mutch;http://ia.media-imdb.com/images/M/MV5BNjU1NjE3Nzg2MV5BMl5BanBnXkFtZTcwNTg5MzM2Mw@@._V1_SX300.jpg;[];132;6.9;1976. Montreal. Eight people who wanted to see and be seen at the trendiest disco will be juggling fame and anonymity until they will be forced to make sober choices in an era when excess was the norm, and when disco was king.;0;0;0;0;1;0;0;0;0;0;0;0;0.306818182;0
Funny People;tt1201167;/m/047svrl;[];20/07/2009;Judd Apatow;Adam Sandler, Seth Rogen, Leslie Mann, Eric Bana;http://ia.media-imdb.com/images/M/MV5BMTMxNDQ5MTA5MF5BMl5BanBnXkFtZTcwMzUyMDUwMg@@._V1_SX300.jpg;['70108781', '70126503'];146;4.8;When seasoned comedian George Simmons learns of his terminal, inoperable health condition, his desire to form a genuine friendship cause him to take a relatively green performer under his wing as his opening act.;0;0;0;1;1;0;0;0;0;0;0;0;0.659090909;0
