title;imdb;mid;trailer;date;directors;actors;poster;netflix_id;runtime;rating;descr;Action;Adventure;Animation;Comedy;Drama;Family;Fantasy;Mystery;Romance;Science Fiction;Thriller;class1;class2;class3
Love's Kitchen;tt1519663;/m/0gj8hlg;[];26/04/2011;James Hacking;Dougray Scott, Sarah Sharman, Katrine De Candole, Lee Boardman;http://ia.media-imdb.com/images/M/MV5BNjg3OTkwNjQxN15BMl5BanBnXkFtZTcwMDY1MTMzNg@@._V1_SX300.jpg;['70173769'];93;5.3;Rob Haley (Dougray Scott), an up-and-coming chef and restaurateur in London, is grief-stricken when he loses his wife. With encouragement from his infamous friend and real life TV Chef ...;0;0;0;1;1;0;0;0;1;0;0;0.032478632;0.988636364;0
Lucky Break;tt0246134;/m/03hhtw_;[];24/08/2001;Peter Cattaneo;James Nesbitt, Olivia Williams, Timothy Spall, Bill Nighy;http://ia.media-imdb.com/images/M/MV5BMTk5NzM2NTY2Ml5BMl5BanBnXkFtZTcwMTI4NzIyMQ@@._V1_SX300.jpg;['60022930'];108;6.3;Under the leadership of a small-time bank robber, British inmates hatch a plan to escape by staging a musical.;1;1;0;1;0;0;0;0;0;0;0;0.305982906;0.352272727;0
Macbeth;tt0067372;/m/0cdjkff;[];06/10/2010;Roman Polanski;Jon Finch, Francesca Annis, Martin Shaw, Terence Bayler;http://ia.media-imdb.com/images/M/MV5BMTU0NTY2NDM5NF5BMl5BanBnXkFtZTcwMDU2NjYxNA@@._V1_SX300.jpg;['70155155'];140;5.2;Macbeth, starring Patrick Stewart, comes to the small screen. Reinterpreted and relocated to an underground netherworld, the Shakespearean classic is heightened with an edgy style.;0;0;0;0;1;0;0;0;0;0;0;0;0.306818182;0
Madagascar;tt0351283;/m/01sbv9;[];25/05/2005;Eric Darnell, Tom McGrath;Ben Stiller, Chris Rock, David Schwimmer, Jada Pinkett Smith;http://ia.media-imdb.com/images/M/MV5BMTY4NDUwMzQxMF5BMl5BanBnXkFtZTcwMDgwNjgyMQ@@._V1_SX300.jpg;['70021636'];86;6.7;Spoiled by their upbringing with no idea what wild life is really like, four animals from New York Central Zoo escape, unwittingly assisted by four absconding penguins, and find themselves in Madagascar, among a bunch of merry lemurs;0;1;1;1;0;1;0;0;0;0;0;0.835897436;0.625;0.050209205
Madame Bovary;tt0102368;/m/03qf5dn;[];03/04/1991;Claude Chabrol;Isabelle Huppert, Jean-François Balmer, Christophe Malavoy, Jean Yanne;http://ia.media-imdb.com/images/M/MV5BMTc4NjYyNzQwN15BMl5BanBnXkFtZTcwMjIxMzUwMg@@._V1_SX300.jpg;['60011722'];134;6.6;In nineteenth-century France, the romantic daughter of a country squire (Emma Rouault) marries a dull country doctor (Charles Bovary). To escape boredom, she throws herself into love ...;0;0;0;0;1;0;0;0;1;0;0;0;0.340909091;0
Main Street;tt1365483;/m/064lxnj;[];21/10/2010;John Doyle;Colin Firth, Ellen Burstyn, Patricia Clarkson, Orlando Bloom;http://ia.media-imdb.com/images/M/MV5BMTA5Mjg3OTQwODheQTJeQWpwZ15BbWU3MDIwOTUzMDY@._V1_SX300.jpg;['70119198'];92;4.7;Several residents of a small Southern city whose lives are changed by the arrival of a stranger with a controversial plan to save their decaying hometown. In the midst of today's ...;0;0;0;0;1;0;0;0;0;0;0;0;0.306818182;0
Making Of;tt0976145;/m/0cs0bxp;[];14/11/2006;Nouri Bouzid;Lotfi Abdelli, Afef Ben Mahmoud, Fatima Ben Saïdane, Helmi Dridi;http://ia.media-imdb.com/images/M/MV5BMjA0NTEyMzY2NV5BMl5BanBnXkFtZTcwNTA1MjU3MQ@@._V1_SX300.jpg;['70070334'];120;6.3;A Tunisian breakdancer falls in with fundamentalists with designs to turn the young man into a suicide bomber.;0;0;0;0;1;0;0;0;0;0;0;0;0.306818182;0
Man on Fire;tt0328107;/m/02lk42;[];21/04/2004;Tony Scott;Denzel Washington, Dakota Fanning, Radha Mitchell, Christopher Walken;http://ia.media-imdb.com/images/M/MV5BMTc3MDc1MTAwMV5BMl5BanBnXkFtZTcwMDY0MTIzMw@@._V1_SX300.jpg;['60034560'];146;8;In Mexico City, a former assassin swears vengeance on those who committed an unspeakable act against the family he was hired to protect.;0;0;0;0;1;0;0;0;0;0;1;0;0.318181818;0
Manhunt;tt1054115;/m/0b6gjvb;[];04/01/2008;Patrik Syversen;Henriette Bruusgaard, Jørn Bjørn Fuller Gee, Lasse Valdal, Nini Bull Robsahm;http://ia.media-imdb.com/images/M/MV5BMTUzMzI0MDYwMF5BMl5BanBnXkFtZTcwNjQ4OTY4Mg@@._V1_SX300.jpg;[];78;5.1;The summer of 1974, four young people are all ambushed and left unconscious. They wake up deep in the woods with no one around but the sound of a hunting horn.;0;0;0;0;0;0;0;0;0;0;1;0.003418803;0;0.874476987
Married Life;tt0804505;/m/0d7y2q;[];2007;Ira Sachs;Chris Cooper, Annabel Kershaw, Pierce Brosnan, Patricia Clarkson;http://ia.media-imdb.com/images/M/MV5BOTUwOTYyMzkxNF5BMl5BanBnXkFtZTcwNjQ2NTg1MQ@@._V1_SX300.jpg;['70092766'];91;5.1;A 1940s-set drama where an adulterous man plots his wife's death instead of putting her through the humiliation of a divorce.;0;0;0;0;1;0;0;0;1;0;0;0;0.340909091;0
Martyrs;tt1029234;/m/04793m3;[];2008;Pascal Laugier;Morjana Alaoui, Mylène Jampanoï, Catherine Bégin, Robert Toupin;http://ia.media-imdb.com/images/M/MV5BMTczMTAxOTI1Nl5BMl5BanBnXkFtZTcwMTYyMzE1Mg@@._V1_SX300.jpg;['70108204'];99;5.9;A young woman's quest for revenge against the people who kidnapped and tormented her as a child leads her and a friend, who is also a victim of child abuse, on a terrifying journey into a living hell of depravity.;0;0;0;0;1;0;0;0;0;0;0;0;0.306818182;0
Mary and Max;tt0978762;;http://video-http.media-imdb.com/MV5BODc5MDA0MDM0Ml5BMTFeQW1wNF5BbWU3MDkxMTkyMzM@.mp4?Expires=1422396442&Signature=bgj0q0qt5QjvpoxbDP0wOXIq5gl40T7fDyIrfXn6tX0U5z7uikC3rJNkWeatfk4q5YloFpDhJ~CV9eekt~QRxHfKDyw57A7ILaLV6eJE1jHZump9QCda0pKiEz-bCUhSo37EYZaUEGbX1wWiIuaCNHWvM2giuS0OE2DoxBu84uI_&Key-Pair-Id=APKAILW5I44IHKUN2DYA;2009;Adam Elliot;Toni Collette, Philip Seymour Hoffman, Barry Humphries, Eric Bana;http://ia.media-imdb.com/images/M/MV5BMTQ1NDIyNTA1Nl5BMl5BanBnXkFtZTcwMjc2Njk3OA@@._V1_.jpg;70111503;92;8.2;A tale of friendship between two unlikely pen pals: Mary, a lonely, eight-year-old girl living in the suburbs of Melbourne, and Max, a forty-four-year old, severely obese man living in New York.;0;0;1;1;1;0;0;0;0;0;0;0.07;0.72;0
Match Point;tt0416320;/m/06gjk9;[];12/05/2005;Woody Allen;Jonathan Rhys Meyers, Alexander Armstrong, Paul Kaye, Matthew Goode;http://ia.media-imdb.com/images/M/MV5BMTMzNzY4MzE5NF5BMl5BanBnXkFtZTcwMzQ1MDMzMQ@@._V1_SX300.jpg;['70035180'];124;7.5;At a turning point in his life, a former tennis pro falls for a femme-fatal type who happens to be dating his friend and soon-to-be brother-in-law.;0;0;0;0;1;0;0;0;1;0;1;0.030769231;0.397727273;0.326359833
Meet Bill;tt0790623;/m/0d67yl;[];08/09/2007;Bernie Goldmann, Melisa Wallack;Aaron Eckhart, Jessica Alba, Elizabeth Banks, Logan Lerman;http://ia.media-imdb.com/images/M/MV5BMTExNDk1MjAxNTJeQTJeQWpwZ15BbWU3MDc4MzkyNjE@._V1_SX300.jpg;['70094768'];93;5.3;A guy fed up with his job and married to a cheating wife reluctantly mentors a rebellious teen.;0;0;0;1;1;0;0;0;1;0;0;0.032478632;0.988636364;0
Melancholia;tt1527186;/m/0fpkhkz;"['http://vimeo.com/zentropa/melancholia', 'http://youtu.be/x_xsm46s2Gg', 'http://www.melancholiathemovie.com/#_trailer', 'http://www.youtube.com/v/8xKArQb82OE&amp;hl=cs&amp;fs=1&amp;rel=0']";18/05/2011;Lars von Trier;Kirsten Dunst, Charlotte Gainsbourg, Alexander Skarsgård, Brady Corbet;http://ia.media-imdb.com/images/M/MV5BMTk4NjM0MjI3MV5BMl5BanBnXkFtZTcwNjcxMDYzNg@@._V1_SX300.jpg;['70184165'];130;6.8;Two sisters find their already strained relationship challenged as a mysterious new planet threatens to collide with Earth.;0;0;0;0;1;0;0;0;0;1;0;0.008547009;0.318181818;0.008368201
Memento;tt0209144;;http://www.totaleclips.com/Player/Bounce.aspx?eclipid=e15133&bitrateid=471&vendorid=102&type=.mp4;2000;Christopher Nolan;Guy Pearce, Carrie-Anne Moss, Joe Pantoliano, Mark Boone Junior;http://ia.media-imdb.com/images/M/MV5BMTc4MjUxNDAwN15BMl5BanBnXkFtZTcwMDMwNDg3OA@@._V1_.jpg;60020435;113;8.5;"A man creates a strange system to help him remember things; so he can hunt for the murderer of his wife without his short-term memory loss being an obstacle.";0;0;0;0;1;0;0;1;0;0;1;0;0.32;0.9
Memories of Murder;tt0353969;;http://video-http.media-imdb.com/MV5BMjEyODAyMzM5M15BMTFeQW1wNF5BbWU4MDY3ODMzNzMx.mp4?Expires=1422405545&Signature=2kqFUjgRBEbdcqBuctteFwqXeQcqa1gpf32y0lrJH0rSytAL8zEyLiR41SXj67vtQh1IWzWqoL3XFa~cwKktbzyMDkm5woXs2bsLwG0eaO08O4kpFLHYcmpC19Rku0VKIfjR4Ihe7vj4qi5PTyeuvbkE9-qaFzAR6ZF3z2SD58g_&Key-Pair-Id=APKAILW5I44IHKUN2DYA;2003;Joon-ho Bong;Kang-ho Song, Sang-kyung Kim, Roe-ha Kim, Jae-ho Song;http://ia.media-imdb.com/images/M/MV5BMTI5OTA5MTI3OF5BMl5BanBnXkFtZTcwMjQyNzYzMQ@@._V1_.jpg;70035995;132;8.1;In 1986, in the province of Gyunggi, in South Korea, a second young and beautiful woman is found dead, raped and tied and gagged with her underwear. Detective Park Doo-Man and Detective Cho...;0;0;0;0;1;0;0;1;0;0;1;0;0.32;0.9
Merci pour le chocolat;tt0232083;/m/0c00r6p;[];25/10/2000;Claude Chabrol;Isabelle Huppert, Jacques Dutronc, Anna Mouglalis, Rodolphe Pauly;http://ia.media-imdb.com/images/M/MV5BMTY3MTIzNjk3OV5BMl5BanBnXkFtZTcwNDI5NzgyMQ@@._V1_SX300.jpg;['60026978'];99;5.5;In Lausanne, the aspirant pianist Jeanne Pollet has lunch with her mother Louise Pollet, her boyfriend Axel and his mother. Lenna leans that when she was born, a nurse had mistakenly told ...;0;0;0;0;1;0;0;0;0;0;1;0;0.318181818;0
Mes Amis, Mes Amours;tt0827192;/m/0dlvlzg;[];2007;Lorraine Lévy;Vincent Lindon, Pascal Elbé, Virginie Ledoyen, Florence Foresti;http://ia.media-imdb.com/images/M/MV5BNTIwMzAxMDM1NV5BMl5BanBnXkFtZTgwMzAzMTA2MDE@._V1_SX300.jpg;[];99;4.6;Mathias and Antoine become a modern-day odd couple when they move in together in London. But while establishing house rules is easy, handling relationships with the opposite sex is another matter!;0;0;0;1;0;0;0;0;1;0;0;0;0.585227273;0
Metamorphosis;tt0431265;/m/0cr_17q;['http://www.youtube.com/watch?v=8OqX9JqZ7po'];07/03/2007;Jenö Hodi;Corey Sevier, Irena Violette, Christopher Lambert, Jennifer Higham;http://ia.media-imdb.com/images/M/MV5BMjAxMTM1NjAxMF5BMl5BanBnXkFtZTcwMTU2NTk5Mw@@._V1_SX300.jpg;['70141600'];98;6;In the Seventeenth Century, while Hungary is fighting the Turks, the population of a small village in the Carpathian Mountains faces the evil Countess Elizabeth Bathory, accused of drinking...;0;0;0;0;0;0;1;0;0;0;1;0.126495726;0;0.828451883
Metropolis;tt0017136;;http://video-http.media-imdb.com/MV5BMTkyNTA2Mjg2OV5BMTFeQW1wNF5BbWU3MDk3NjE1NjM@.mp4?Expires=1422396921&Signature=QQ2r3wmr7Jfwkq4hgwQ3C7J5epe19VHYhPGpLe5HVfyS0~VJzKaKLH4KJ98zTUSs1MSkxK~kwfgO7ebKpQH~P63oW-R9Gcmz0MRb8TEJ05LGGye~h5pKtACRpTDYu5yT1ZfA3Z~96OEEmGxb4b3x~EM2cMSvU0oDsiNls8i8n34_&Key-Pair-Id=APKAILW5I44IHKUN2DYA;1927;Fritz Lang;Alfred Abel, Gustav Fröhlich, Rudolf Klein-Rogge, Fritz Rasp;http://ia.media-imdb.com/images/M/MV5BNDAzNTkyODg1MF5BMl5BanBnXkFtZTgwMDA3NDkwMDE@._V1_.jpg;60026474;153;8.3;In a futuristic city sharply divided between the working class and the city planners, the son of the city's mastermind falls in love with a working class prophet who predicts the coming of a savior to mediate their differences.;0;0;0;0;1;0;0;0;0;1;0;0.01;0.32;0
Michael Clayton;tt0465538;/m/0fh694;['http://flixray.com/movie_reviews/Michael-Clayton.html'];31/08/2007;Tony Gilroy;Tom Wilkinson, Michael O'Keefe, Sydney Pollack, Danielle Skraastad;http://ia.media-imdb.com/images/M/MV5BMTc0NTU5MjI2MV5BMl5BanBnXkFtZTcwMTg5NTQzMw@@._V1_SX300.jpg;['70059995'];119;4.6;"A law firm brings in its ""fixer"" to remedy the situation after a lawyer has a breakdown while representing a chemical company that he knows is guilty in a multi-billion dollar class action suit.";0;0;0;0;1;0;0;1;0;0;1;0.001709402;0.329545455;0.39748954
MILF;tt1730704;/m/0g56dc1;[];26/10/2010;Scott Wheeler;Jack Cullison, Philip Marlatt, Joseph Booton, Ramon Camacho;http://ia.media-imdb.com/images/M/MV5BMTk2ODY5NjMyOV5BMl5BanBnXkFtZTcwNTk1MTIwNA@@._V1_SX300.jpg;['70147478'];88;3.8;A group of nerdy college guys who can't seem to connect with girls their own age discover the excitement of hooking up with sexy older women.;0;0;0;1;1;0;0;0;1;0;0;0.032478632;0.988636364;0
Milk;tt1013753;/m/03hkch7;['http://www.youtube.com/watch?v=Zp0uYT0zDbA'];28/10/2008;Gus Van Sant;Sean Penn, Emile Hirsch, Josh Brolin, Diego Luna;http://ia.media-imdb.com/images/M/MV5BMTI2OTM5NjUzMV5BMl5BanBnXkFtZTcwMzY1MTM5MQ@@._V1_SX300.jpg;['70100084'];128;6.1;The story of Harvey Milk, and his struggles as an American gay activist who fought for gay rights and became California's first openly gay elected official.;0;0;0;0;1;0;0;0;0;0;0;0;0.306818182;0
Million Dollar Baby;tt0405159;;http://www.totaleclips.com/Player/Bounce.aspx?eclipid=e22674&bitrateid=472&vendorid=102&type=.mp4;2004;Clint Eastwood;Clint Eastwood, Hilary Swank, Morgan Freeman, Jay Baruchel;http://ia.media-imdb.com/images/M/MV5BMTkxNzA1NDQxOV5BMl5BanBnXkFtZTcwNTkyMTIzMw@@._V1_.jpg;70018292;132;8.1;A determined woman works with a hardened boxing trainer to become a professional.;0;0;0;0;1;0;0;0;0;0;0;0;0.31;0
Mimic 2;tt0239641;/m/026gfr1;[];22/08/2001;Jean de Segonzac;Alix Koromzay, Bruno Campos, Will Estes, Gaven E. Lucas;http://ia.media-imdb.com/images/M/MV5BMTMxNTYxOTg0MF5BMl5BanBnXkFtZTcwNTIzNDkyMQ@@._V1_SX300.jpg;['60020466'];82;4.7;When a cockroach-spread plague threatened to decimate the child population of New York City in the original Mimic, biologist Susan Tyler and her research associates developed a crossbreed ...;0;0;0;0;0;0;0;0;0;1;1;0.148717949;0.011363636;0.786610879
Minority Report;tt0181689;/m/011wtv;[];17/06/2002;Steven Spielberg;Tom Cruise, Max von Sydow, Steve Harris, Neal McDonough;http://ia.media-imdb.com/images/M/MV5BMTc1NDI5NzQyNF5BMl5BanBnXkFtZTYwMjc4NTE5._V1_SX300.jpg;['60023071'];145;8.1;In a future where a special police unit is able to arrest murderers before they commit their crimes, an officer from that unit is himself accused of a future murder.;1;0;0;0;1;0;0;1;0;1;1;0.384615385;0.375;0.983263598
Minotaur;tt0415160;/m/05t1gh;[];11/03/2006;Jonathan English;Tom Hardy, Michelle Van Der Water, Tony Todd, Lex Shrapnel;http://ia.media-imdb.com/images/M/MV5BMTc4Nzc0NDM2OF5BMl5BanBnXkFtZTcwNTAxOTIzMQ@@._V1_SX300.jpg;['70049793'];93;5.5;Long ago in the Iron Age a shadow loomed over a lonely village. For generations the village youths are stolen from their families and delivered as sacrifice to a mythical beast - the ...;0;1;0;0;0;0;1;0;0;0;0;0.294017094;0;0.213389121
Miracle;tt0349825;/m/02crgz;[];02/02/2004;Gavin O'Connor;Kurt Russell, Patricia Clarkson, Noah Emmerich, Sean McCann;http://ia.media-imdb.com/images/M/MV5BMjEyOTk1OTcyNV5BMl5BanBnXkFtZTYwNjMzNDU3._V1_SX300.jpg;['60033300'];135;7.2;Miracle tells the true story of Herb Brooks (Russell), the player-turned-coach who led the 1980 U.S. Olympic hockey team to victory over the seemingly invincible Russian squad.;0;0;0;0;1;0;0;0;0;0;0;0;0.306818182;0
Miranda;tt0089598;/m/0cs50fz;[];15/10/1985;Tinto Brass;Serena Grandi, Andrea Occhipinti, Franco Interlenghi, Andy J. Forest;http://ia.media-imdb.com/images/M/MV5BNjgyMDYwNjY0OF5BMl5BanBnXkFtZTcwOTc0NjcxMQ@@._V1_SX300.jpg;['70008807'];96;5.6;In this erotic comedy, Miranda is the landlady of a small country tavern who is looking for a husband, and tries out a variety of men for size.;0;0;0;1;1;0;0;0;0;0;0;0;0.659090909;0
Mirrors 2;tt1576699;/m/0cp1764;[];2010;Víctor García;Nick Stahl, Emmanuelle Vaugier, Evan Jones, Christy Carlson Romano;http://ia.media-imdb.com/images/M/MV5BMjE4MTY4ODMwN15BMl5BanBnXkFtZTcwMzA5NDg3Mw@@._V1_SX300.jpg;['70147556'];86;4;When Max, who is recovering from a traumatic accident, takes a job as a nighttime security guard, he begins to see visions of a young mysterious woman in the store's mirror.;0;0;0;0;0;0;0;0;0;0;1;0.003418803;0;0.874476987
Mischief Night;tt0481581;/m/03grgng;[];;Penny Woolcock;Kelli Hollis, James Foster, Michael Taylor, Holly Kenny;http://ia.media-imdb.com/images/M/MV5BMTgzNDE0MjIyNl5BMl5BanBnXkFtZTcwNDI5NzMwMg@@._V1_SX300.jpg;[];93;6;About two families (one white, one Asian) who come together unexpectedly on a local night of carnival trickery and festivity.;0;0;0;1;0;0;0;0;0;0;0;0;0.585227273;0
Miss Bala;tt1911600;/m/0gmcp86;['http://www.youtube.com/watch?v=rrTyAbgjF04', 'http://vimeo.com/22405151'];13/05/2011;Gerardo Naranjo;Stephanie Sigman, Juan Carlos Galván, Noé Hernández, Irene Azuela;http://ia.media-imdb.com/images/M/MV5BMjIyMTY1NTg1Nl5BMl5BanBnXkFtZTcwMjU1OTIyNw@@._V1_SX300.jpg;['70189494'];113;6.1;After entering a beauty contest in Tijuana, a young woman witnesses drug-related murders and is forced to do the gang's bidding.;0;0;0;0;1;0;0;0;0;0;1;0;0.318181818;0
Miss Potter;tt0482546;/m/0b921t;[];03/12/2006;Chris Noonan;Renée Zellweger, Ewan McGregor, Emily Watson, Barbara Flynn;http://ia.media-imdb.com/images/M/MV5BMTA0NjgzMDIzNjVeQTJeQWpwZ15BbWU3MDE3ODk0NDE@._V1_SX300.jpg;['70045853'];92;5.7;"The story of Beatrix Potter, the author of the beloved and best-selling children's book, ""The Tale of Peter Rabbit"", and her struggle for love, happiness and success.";0;0;0;0;1;0;0;0;1;0;0;0;0.340909091;0
Missing in America;tt0384699;/m/084_jb;[];28/05/2005;Gabrielle Savage Dockterman;Danny Glover, Ron Perlman, Linda Hamilton, Zoe Weizenbaum;http://ia.media-imdb.com/images/M/MV5BMTQ1NDQxNDI1Ml5BMl5BanBnXkFtZTcwNzMyNjUzMQ@@._V1_SX300.jpg;['70042401'];102;6.7;A haunted Vietnam veteran (Danny Glover), living in exile in the forests of the Pacific Northwest, is faced with a life-changing decision after he is visited by a former platoon member (...;0;0;0;0;1;0;0;0;0;0;0;0;0.306818182;0
Mission: Impossible II;tt0120755;/m/02b61v;[];24/05/2000;John Woo;Tom Cruise, Dougray Scott, Thandie Newton, Ving Rhames;http://ia.media-imdb.com/images/M/MV5BODI4Mzk0NDU0NF5BMl5BanBnXkFtZTcwNTczODQwNA@@._V1_SX300.jpg;['60000521'];123;5.4;"A secret agent is sent to Sydney, to find and destroy a genetically modified disease called ""Chimera""";1;0;0;0;0;0;0;0;0;0;1;0.295726496;0;0.694560669
Modern Love;tt0808380;/m/04myyyt;[];2006;Alex Frayne;Michael Baldwin, Don Barker, Craig Behenna, Mark Constable;http://ia.media-imdb.com/images/M/MV5BMTAzMTQwNzQwMTFeQTJeQWpwZ15BbWU3MDQ5NDU2NzE@._V1_SX300.jpg;['70132876'];110;4.3;JOHN, his wife EMILY, and their small son EDWARD leave the city for what they believe will be a brief foray to the countryside to claim John's inheritance - a small shack. They find ...;0;0;0;0;0;0;0;1;0;0;1;0.008547009;0;0.912133891
Modern Times;tt0027977;;;1936;Charles Chaplin;Charles Chaplin, Paulette Goddard, Henry Bergman, Tiny Sandford;http://ia.media-imdb.com/images/M/MV5BMjAyMTkxNjI5OF5BMl5BanBnXkFtZTYwMjI2MjA5._V1_.jpg;60028129;87;8.6;The Tramp struggles to live in modern industrial society with the help of a young homeless woman.;0;0;0;1;1;1;0;0;0;0;0;0.04;0.72;0
Monsieur Batignole;tt0291400;/m/0c1j0vp;[];2002;Gérard Jugnot;Jules Sitruk, Gérard Jugnot, Michèle Garcia, Jean-Paul Rouve;http://ia.media-imdb.com/images/M/MV5BMTYyNjk1NzgzM15BMl5BanBnXkFtZTYwODI0ODc5._V1_SX300.jpg;[];100;6.8;In 1942, in an occupied Paris, the apolitical grocer Edmond Batignole lives with his wife and daughter in a small apartment in the building of his grocery. When his future son-in-law and ...;0;0;0;1;1;0;0;0;0;0;0;0;0.659090909;0
Monster;tt0340855;/m/0294mx;['http://www.youtube.com/watch?v=OX02QBHid7o&feature=player_detailpage'];16/11/2003;Patty Jenkins;Charlize Theron, Christina Ricci, Bruce Dern, Lee Tergesen;http://ia.media-imdb.com/images/M/MV5BMTI4NzI5NzEwNl5BMl5BanBnXkFtZTcwNjc1NjQyMQ@@._V1_SX300.jpg;['60032559'];109;7.1;Based on the life of Aileen Wuornos, a Daytona Beach prostitute who became a serial killer.;0;0;0;0;1;0;0;0;0;0;0;0;0.306818182;0
Monsters, Inc.;tt0198781;;http://video-http.media-imdb.com/MV5BM2MxN2I4MzYtZjA4Ny00ZWFhLWI1MDQtMDhhMjI5MGZhMTNhXkExMV5BbXA0XkFpbWRiLWV0cy10cmFuc2NvZGU@.mp4?Expires=1422395140&Signature=EqAN9s5idjUJplsxhW2p1pxQe38jUh6EMCbEdBe36pE8XIwtkFITxQAfvTIyfrYpCUJ3TUUCtNcXu8o4DdpFKCG5dCSum4n8tH5xSb33VG5FV1WdvvOx0t48kOTxrEVgyplusGHUkRlMPIy~g0voQU~WQkBjX1zAvRAQotw~N~o_&Key-Pair-Id=APKAILW5I44IHKUN2DYA;2001;Pete Docter, David Silverman, Lee Unkrich;John Goodman, Billy Crystal, Mary Gibbs, Steve Buscemi;http://ia.media-imdb.com/images/M/MV5BMTY1NTI0ODUyOF5BMl5BanBnXkFtZTgwNTEyNjQ0MDE@._V1_.jpg;60004479;92;8.1;Monsters generate their city's power by scaring children, but they are terribly afraid themselves of being contaminated by children, so when one enters Monstropolis, top scarer Sulley finds his world disrupted.;0;1;1;1;0;1;1;0;0;0;0;0.83;0.52;0.28
Monty Python and the Holy Grail;tt0071853;;http://www.totaleclips.com/Player/Bounce.aspx?eclipid=e109236&bitrateid=471&vendorid=102&type=.mp4;1975;Terry Gilliam, Terry Jones;Graham Chapman, John Cleese, Eric Idle, Terry Gilliam;http://ia.media-imdb.com/images/M/MV5BMTkzODczMTgwM15BMl5BanBnXkFtZTYwNTAwODI5._V1_.jpg;771476;91;8.4;King Arthur and his knights embark on a low-budget search for the Grail, encountering many very silly obstacles.;0;1;0;1;0;0;1;0;0;0;0;0.33;0.61;0.26
Moon;tt1182345;/m/04zxmvq;[];23/01/2009;Duncan Jones;Sam Rockwell, Kevin Spacey, Dominique McElligott, Rosie Shaw;http://ia.media-imdb.com/images/M/MV5BMTgzODgyNTQwOV5BMl5BanBnXkFtZTcwNzc0NTc0Mg@@._V1_SX300.jpg;['70112500'];97;8;Astronaut Sam Bell has a quintessentially personal encounter toward the end of his three-year stint on the Moon, where he, working alongside his computer, GERTY, sends back to Earth parcels of a resource that has helped diminish our planet's power problems.;0;0;0;0;1;0;0;0;0;1;1;0.011965812;0.329545455;0.037656904
Moonrise Kingdom;tt1748122;/m/0gkz3nz;['http://youtu.be/ocac5Umhb9g'];16/05/2012;Wes Anderson;Bruce Willis, Edward Norton, Bill Murray, Frances McDormand;http://ia.media-imdb.com/images/M/MV5BMTEwMTc3NDkzOTJeQTJeQWpwZ15BbWU3MDI4NTAwNzc@._V1_SX300.jpg;['70228041'];157;8.1;A pair of young lovers flee their New England town, which causes a local search party to fan out to find them.;0;0;0;1;1;0;0;0;1;0;0;0.032478632;0.988636364;0
Morning Glory;tt1126618;/m/05zntwr;[];10/11/2010;Roger Michell;Rachel McAdams, Noah Bean, Jack Davidson, Vanessa Aspillaga;http://ia.media-imdb.com/images/M/MV5BMTYxNDM1NTQ4N15BMl5BanBnXkFtZTcwOTQ0Njg5Mw@@._V1_SX300.jpg;['70122644'];107;6.3;An upstart television producer accepts the challenge of reviving a struggling morning show program with warring co-hosts.;0;0;0;1;1;0;0;0;1;0;0;0.032478632;0.988636364;0
Mother's Day;tt1434435;/m/07kdp25;[];23/09/2010;Darren Lynn Bousman;Rebecca De Mornay, Jaime King, Patrick John Flueger, Warren Kole;http://ia.media-imdb.com/images/M/MV5BMjEyMTI3ODcwOF5BMl5BanBnXkFtZTcwMDUzOTA1Nw@@._V1_SX300.jpg;['70130444'];112;7.1;The sadistic members of a villainous family return to their childhood home to terrorize the new home owners and their guests.;1;0;0;0;1;0;0;0;0;0;1;0.061538462;0.329545455;0
Mr. Smith Goes to Washington;tt0031679;;http://www.totaleclips.com/Player/Bounce.aspx?eclipid=e10914&bitrateid=471&vendorid=102&type=.mp4;1939;Frank Capra;Jean Arthur, James Stewart, Claude Rains, Edward Arnold;http://ia.media-imdb.com/images/M/MV5BMjAwMzU5ODkwNF5BMl5BanBnXkFtZTcwNTg4Mjk3OA@@._V1_.jpg;779080;129;8.3;A naive man is appointed to fill a vacancy in the US Senate. His plans promptly collide with political corruption, but he doesn't back down.;0;0;0;0;1;0;0;0;0;0;0;0;0.31;0
Mulholland Drive;tt0166924;/m/0571m;[];16/05/2001;David Lynch;Naomi Watts, Laura Harring, Ann Miller, Dan Hedaya;http://ia.media-imdb.com/images/M/MV5BMjM1Njg2ODA4OF5BMl5BanBnXkFtZTgwMDM3Mjc1MDE@._V1_SX300.jpg;['60021646'];147;7.6;After a car wreck on the winding Mulholland Drive renders a woman amnesiac, she and a perky Hollywood-hopeful search for clues and answers across Los Angeles in a twisting venture beyond dreams and reality.;0;0;0;0;1;0;0;1;0;0;1;0.001709402;0.329545455;0.39748954
Mulligans;tt1106447;/m/0crvm07;[];2008;Chip Hale;Dan Payne, Thea Gill, Charlie David, Derek Baynham;http://ia.media-imdb.com/images/M/MV5BMTI1ODgxNzAxN15BMl5BanBnXkFtZTcwNTM0MjU1MQ@@._V1_SX300.jpg;['70113565'];92;6.3;Two college friends take a journey home. One of them makes a mistake that may tear a family apart. Sometimes there are no second chances, sometimes there are no mulligans.;0;0;0;0;1;0;0;0;1;0;0;0;0.340909091;0
My Neighbor Totoro;tt0096283;;;1988;Hayao Miyazaki;Chika Sakamoto, Hitoshi Takagi, Noriko Hidaka, Shigesato Itoi;http://ia.media-imdb.com/images/M/MV5BMjE3NzY5ODQwMV5BMl5BanBnXkFtZTcwNzY1NzcxNw@@._V1_.jpg;60032294;86;8.3;When two girls move to the country to be near their ailing mother, they have adventures with the wonderous forest spirits who live nearby.;0;1;1;0;1;1;1;0;0;0;0;0.76;0.34;0.09
My Sassy Girl;tt0404254;/m/0286k0s;[];26/06/2008;Yann Samuell;Elisha Cuthbert, Jesse Bradford, Austin Basis, Chris Sarandon;http://ia.media-imdb.com/images/M/MV5BMTk3Mzc3ODkyNF5BMl5BanBnXkFtZTcwMDgyMTg4MQ@@._V1_SX300.jpg;['70101372'];92;7.7;A sweet Midwestern guy with his life planned out for himself is wooed, groomed, and ultimately dumped by a complicated, elusive gal.;0;0;0;1;1;0;0;0;1;0;0;0.032478632;0.988636364;0
My Week with Marilyn;tt1655420;/m/0dgst_d;['http://www.youtube.com/watch?v=rFcY7PEY9bs'];09/10/2011;Simon Curtis;Michelle Williams, Eddie Redmayne, Julia Ormond, Kenneth Branagh;http://ia.media-imdb.com/images/M/MV5BMTYzODYwOTIzOV5BMl5BanBnXkFtZTcwODE2NjAwNw@@._V1_SX300.jpg;['70202150'];99;6.9;Colin Clark, an employee of Sir Laurence Olivier's, documents the tense interaction between Olivier and Marilyn Monroe during the production of The Prince and the Showgirl (1957).;0;0;0;0;1;0;0;0;0;0;0;0;0.306818182;0
Mystic River;tt0327056;/m/02c638;['http://www.apple.com/trailers/wb/mystic_river/', 'http://youtu.be/nmiA24jwlbM'];23/05/2003;Clint Eastwood;Sean Penn, Tim Robbins, Kevin Bacon, Laurence Fishburne;http://ia.media-imdb.com/images/M/MV5BMTIzNDUyMjA4MV5BMl5BanBnXkFtZTYwNDc4ODM3._V1_SX300.jpg;['60031232'];138;8.3;With a childhood tragedy that overshadowed their lives, three men are reunited by circumstance when one has a family tragedy.;0;0;0;0;1;0;0;1;0;0;1;0.001709402;0.329545455;0.39748954
