title;imdb;mid;trailer;date;directors;actors;poster;netflix_id;runtime;rating;descr;Action;Adventure;Animation;Comedy;Drama;Family;Fantasy;Mystery;Romance;Science Fiction;Thriller;class1;class2;class3
Star Wars: The Clone Wars;tt1185834;/m/0cpllql;[];10/08/2008;Dave Filoni;Matt Lanter, Ashley Eckstein, James Arnold Taylor, Dee Bradley Baker;http://ia.media-imdb.com/images/M/MV5BMTI1MDIwMTczOV5BMl5BanBnXkFtZTcwNTI4MDE3MQ@@._V1_SX300.jpg;['70098333'];98;6.5;As the Clone Wars sweep through the galaxy, the heroic Jedi Knights struggle to maintain order and restore peace. More and more systems are falling prey to the forces of the dark side as ...;1;1;1;0;0;1;1;0;0;1;1;1;0.045454545;0.769874477
Starbuck;tt1756750;/m/0h3mkwb;['http://www.youtube.com/watch?v=Z2MD0qJkWzU', 'http://www.youtube.com/watch?v=KWPW907qGWo', 'http://www.youtube.com/embed/qbZv4sm9I5g', 'http://www.youtube.com/watch?v=MfQIJaGON1M'];27/07/2011;Ken Scott;Patrick Huard, Julie LeBreton, Antoine Bertrand, Dominic Philie;http://ia.media-imdb.com/images/M/MV5BMjMyMDczMzU1OV5BMl5BanBnXkFtZTcwMzMwNzk1OA@@._V1_SX300.jpg;['70209149'];109;8.6;As his lover announces her pregnancy, a fortysomething slacker receives other life-changing news: 142 people, all of them the result of artificial insemination, have filed a class action lawsuit against him, their biological father.;0;0;0;1;1;0;0;0;0;0;0;0;0.659090909;0
Strangers on a Train;tt0044079;;http://www.totaleclips.com/Player/Bounce.aspx?eclipid=e12147&bitrateid=471&vendorid=102&type=.mp4;1951;Alfred Hitchcock;Farley Granger, Ruth Roman, Robert Walker, Leo G. Carroll;http://ia.media-imdb.com/images/M/MV5BMTcwNzk0MTQxMF5BMl5BanBnXkFtZTcwNjM5NTIwNA@@._V1_.jpg;70002982;101;8.1;A psychotic socialite confronts a pro tennis star with a theory on how two complete strangers can get away with murder...a theory that he plans to implement.;0;0;0;0;1;0;0;0;0;0;1;0;0.32;0
Strings;tt1340799;/m/0h543t4;[];10/06/2011;Mark Dennis, Ben Foster;Billy Harvey, Elle LaMont, Chris Potter, Karl Anderson;http://ia.media-imdb.com/images/M/MV5BMjA1OTE2NjM3MV5BMl5BanBnXkFtZTcwMzUwMjEyOQ@@._V1_SX300.jpg;[];98;5.9;In the wake of his daughter's death, a troubled musician seeks out an experimental therapist to turn his life around. When the therapist calls for him to leave everything behind and take on...;0;0;0;0;1;0;0;0;0;0;1;0;0.318181818;0
Submarine;tt1440292;/m/0ddfwj1;[];12/09/2010;Richard Ayoade;Noah Taylor, Paddy Considine, Craig Roberts, Yasmin Paige;http://ia.media-imdb.com/images/M/MV5BMTQ5ODMxNTIyNV5BMl5BanBnXkFtZTcwNjQ1ODgyNQ@@._V1_SX300.jpg;['70136077'];97;7.4;15-year-old Oliver Tate has two objectives: To lose his virginity before his next birthday, and to extinguish the flame between his mother and an ex-lover who has resurfaced in her life.;0;0;0;1;1;0;0;0;1;0;0;0.032478632;0.988636364;0
Suddenly;tt0324158;/m/03hmb45;[];2002;Diego Lerman;Tatiana Saphir, Carla Crespo, Veronica Hassan, Beatriz Thibaudin;http://ia.media-imdb.com/images/M/MV5BODA0NjQ5ODA1Ml5BMl5BanBnXkFtZTcwNDQ3NjcyMQ@@._V1_SX300.jpg;['60029215'];92;6.5;An Argentinian Dutch and Latin Comedy Drama where a young naive girl Marcia (Tatiana Saphir) learns about her sexuality. Marcia is kidnapped by 2 punk women Mao (Carla Crespo)& Veronica ...;0;0;0;1;1;0;0;0;0;0;0;0;0.659090909;0
Sugar;tt0990413;/m/03h5cw3;[];21/01/2008;Anna Boden, Ryan Fleck;Jose Rijo, Walki Cuevas, Algenis Perez Soto, Santo Silvestre;http://ia.media-imdb.com/images/M/MV5BMTMzMzI0OTIyOF5BMl5BanBnXkFtZTcwMzU1NzEzMg@@._V1_SX300.jpg;['70084156'];114;6.7;"Dominican baseball star Miguel ""Sugar"" Santos is recruited to play in the U.S. minor-leagues.";0;0;0;0;1;0;0;0;0;0;0;0;0.306818182;0
Summer's Blood;tt1285010;/m/064mdnk;[];02/11/2009;Lee Demarbre;Ashley Greene, Peter Mooney, Barbara Niven, Stephen McHattie;http://ia.media-imdb.com/images/M/MV5BMjEzOTExNDYyN15BMl5BanBnXkFtZTgwMjIyODg0MDE@._V1_SX300.jpg;[];91;5.4;A family of serial killers stalk a young woman out to find the father she's never known.;0;0;0;0;0;0;0;0;0;0;1;0.003418803;0;0.874476987
Sunset Blvd.;tt0043014;;http://video-http.media-imdb.com/MV5BYzY4YzY1NDMtYTI3Zi00ZjljLTliY2YtYzZkNmNmZDlkNGQ4XkExMV5BbXA0XkFpbWRiLWV0cy10cmFuc2NvZGU@.mp4?Expires=1422401550&Signature=hHdSAooZwYK~JDzWV6ystBA5ZxYl97QhZwJkVvytz9KzCtXAjxSRKLTdLU02hvPr2Rd5xfzQQpEQ-PuADxK7xejHtT4DvCM57GUUYPGhjZyJb5gFaz-MZlULEUtgnJb5GazuS~0t0~uEzc6uLYkwe0mmOsvyOacCem1IFeNUAbA_&Key-Pair-Id=APKAILW5I44IHKUN2DYA;1950;Billy Wilder;William Holden, Gloria Swanson, Erich von Stroheim, Nancy Olson;http://ia.media-imdb.com/images/M/MV5BMTc3NDYzODAwNV5BMl5BanBnXkFtZTgwODg1MTczMTE@._V1_.jpg;60010956;110;8.5;A hack screenwriter writes a screenplay for a former silent-film star who has faded into Hollywood obscurity.;0;0;0;0;1;0;0;0;0;0;0;0;0.31;0
Sunshine;tt0448134;/m/091d5d;[];23/03/2007;Danny Boyle;Cillian Murphy, Michelle Yeoh, Troy Garity, Rose Byrne;http://ia.media-imdb.com/images/M/MV5BMTU5Nzg2OTk2NF5BMl5BanBnXkFtZTYwNTc1ODM3._V1_SX300.jpg;['70051674'];107;6.9;A team of international astronauts is sent on a dangerous mission to reignite the dying Sun with a nuclear fission bomb in 2057.;0;1;0;0;0;0;0;0;0;1;1;0.266666667;0;0.560669456
Sunshine Cleaning;tt0862846;/m/03cvx8t;['http://www.youtube.com/watch?v=t26-L8PpcmI', 'http://www.youtube.com/watch?v=iHDXkV6T_N8'];18/01/2008;Christine Jeffs;Amy Adams, Emily Blunt, Alan Arkin, Jason Spevack;http://ia.media-imdb.com/images/M/MV5BMTU4MzUzMTg4M15BMl5BanBnXkFtZTcwNDY2MjUyMg@@._V1_SX300.jpg;['70084157'];91;6.6;In order to raise the tuition to send her young son to private school, a mom starts an unusual business -- a biohazard removal/crime scene clean-up service -- with her unreliable sister.;0;0;0;1;1;0;0;0;0;0;0;0;0.659090909;0
Super 8;tt1650062;/m/0bwfwpj;['http://www.youtube.com/watch?v=FYzXaYmFQjo'];09/06/2011;J.J. Abrams;Joel Courtney, Jessica Tuck, Joel McKinnon Miller, Ryan Lee;http://ia.media-imdb.com/images/M/MV5BMTM5NzkxMzQ5MF5BMl5BanBnXkFtZTcwNDYwMTA3NA@@._V1_SX300.jpg;['70171581'];112;7.2;During the summer of 1979, a group of friends witness a train crash and investigate subsequent unexplained events in their small town.;1;1;0;0;1;0;1;1;0;1;1;0.803418803;0.420454545;0.991631799
Surveillance;tt0409345;/m/02qr50c;[];08/02/2008;Jennifer Chambers Lynch;Caroline Aaron, Hugh Dillon, David Gane, Gill Gayle;http://ia.media-imdb.com/images/M/MV5BMTkzNDExOTM4OF5BMl5BanBnXkFtZTcwOTUwNDY3Mg@@._V1_SX300.jpg;['70082816', '70116677'];97;5.7;Two FBI agents attempt to clarify the murders occurring in a desolate region. They approach the witnesses of the latest incident with the help of the local police. All of them hide something and all have wildly different stories to tell.;0;0;0;0;1;0;0;1;0;0;1;0.001709402;0.329545455;0.39748954
Taken;tt0936501;/m/03mgx6z;[];27/02/2008;Pierre Morel;Liam Neeson, Maggie Grace, Leland Orser, Jon Gries;http://ia.media-imdb.com/images/M/MV5BMTM4NzQ0OTYyOF5BMl5BanBnXkFtZTcwMDkyNjQyMg@@._V1_SX300.jpg;['70101374'];93;7.7;A retired CIA agent travels across Europe and relies on his old skills to save his estranged daughter, who has been kidnapped while on a trip to Paris.;1;0;0;0;0;0;0;0;0;0;1;0.295726496;0;0.694560669
Taken 2;tt1397280;/m/0hhggmy;['http://www.youtube.com/watch?v=9FhdYOZoKcs'];07/09/2012;Olivier Megaton;Liam Neeson, Maggie Grace, Famke Janssen, Leland Orser;http://ia.media-imdb.com/images/M/MV5BMTkwNTQ0ODExOV5BMl5BanBnXkFtZTcwNjU3NDQwOA@@._V1_SX300.jpg;[];92;6.1;In Istanbul, retired CIA operative Bryan Mills and his wife are taken hostage by the father of a kidnapper Mills killed while rescuing his daughter.;1;0;0;0;0;0;0;0;0;0;1;0.295726496;0;0.694560669
Tapas;tt0434382;/m/09zvl4;[];23/04/2005;José Corbacho, Juan Cruz;Ángel de Andrés López, María Galiana, Elvira Mínguez, Rubén Ochandiano;http://ia.media-imdb.com/images/M/MV5BMTQ2NDk1NzcxNl5BMl5BanBnXkFtZTgwODA3NTAzMTE@._V1_SX300.jpg;[];94;5.7;The small, everyday stories of a group of neighbours who live in a suburb of Barcelona, and the little secrets that they hide.;0;0;0;1;1;0;0;0;0;0;0;0;0.659090909;0
Taxi Driver;tt0075314;;http://www.totaleclips.com/Player/Bounce.aspx?eclipid=e87541&bitrateid=472&vendorid=102&type=.mp4;1976;Martin Scorsese;Diahnne Abbott, Frank Adu, Victor Argo, Gino Ardito;http://ia.media-imdb.com/images/M/MV5BMTQ1Nzg3MDQwN15BMl5BanBnXkFtZTcwNDE2NDU2MQ@@._V1_.jpg;18907685;113;8.4;A mentally unstable Vietnam war veteran works as a night-time taxi driver in New York City where the perceived decadence and sleaze feeds his urge for violent action, attempting to save a preadolescent prostitute in the process.;0;0;0;0;1;0;0;0;0;0;0;0;0.31;0
Ted;tt1637725;/m/0gj9tn5;"['http://www.tedisreal.com/site.html', 'http://www.youtube.com/v/P3eopGRo7lw&amp;hl=cs&amp;fs=1&amp;rel=0']";29/06/2012;Seth MacFarlane;Mark Wahlberg, Mila Kunis, Seth MacFarlane, Joel McHale;http://ia.media-imdb.com/images/M/MV5BMTQ1OTU0ODcxMV5BMl5BanBnXkFtZTcwOTMxNTUwOA@@._V1_SX300.jpg;['70218756'];94;6.8;As the result of a childhood wish, John Bennett's teddy bear, Ted, came to life and has been by John's side ever since - a friendship that's tested when Lori, John's girlfriend of four years, wants more from their relationship.;0;0;0;1;0;0;1;0;0;0;0;0.18974359;0.579545455;0
Tell-Tale;tt1135095;/m/04y6wyj;[];24/04/2009;Michael Cuesta;Josh Lucas, Lena Headey, Brian Cox, Bea Miller;http://ia.media-imdb.com/images/M/MV5BMTY4MDg3ODQyM15BMl5BanBnXkFtZTcwODYyOTkxMw@@._V1_SX300.jpg;['70117048'];93;4.7;A man's newly transplanted heart leads him on a dangerous journey to find out who murdered its donor.;0;0;0;0;1;0;0;0;0;1;1;0.011965812;0.329545455;0.037656904
Ten Dead Men;tt0854679;/m/04ctvbx;[];2008;Ross Boyask;Brendan Carr, Terry Stone, Doug Bradley, Keith Eyles;http://ia.media-imdb.com/images/M/MV5BMTQ2NzQwNjA0OV5BMl5BanBnXkFtZTcwMTY0MTUwMg@@._V1_SX300.jpg;['70110978'];90;4.7;Ten men took away his life. Now ten men will pay with their's. Ryan is left for dead, but returns to his old ways for one last revenge trip. And it's going to be bloody!;1;0;0;0;0;0;0;0;0;0;1;0.295726496;0;0.694560669
Terminator 2: Judgment Day;tt0103064;;http://video-http.media-imdb.com/MV5BNzAyYjU0NzMtMzk3ZS00NDBlLTg2OTMtODczZmIyNTlkMzc0XkExMV5BbXA0XkFpbWRiLWV0cy10cmFuc2NvZGU@.mp4?Expires=1422399463&Signature=tEkTkm0spPSUMcBSl6XWNPYldmuLsmXYcvhuA6gzxxzAJjZeAHG7ONHtSJ6ShguL4A79mRBJXTEUcNX0cqKJUdnLD~fDSthHGQOG0XcunpvHxtSMUEZkUjmoaYlnO46ap77T~I2yzBh8DByxmRZqZiS2mQzOPtnPoXObiZiBw20_&Key-Pair-Id=APKAILW5I44IHKUN2DYA;1991;James Cameron;Arnold Schwarzenegger, Linda Hamilton, Edward Furlong, Robert Patrick;http://ia.media-imdb.com/images/M/MV5BMTg5NzUwMDU5NF5BMl5BanBnXkFtZTcwMjk2MDA4Mg@@._V1_.jpg;60028203;137;8.5;A cyborg, identical to the one who failed to kill Sarah Connor, must now protect her young son, John Connor, from a more advanced cyborg, made out of liquid metal.;1;0;0;0;0;0;0;0;0;1;1;0.37;0.01;0.61
Tetro;tt0964185;/m/02wc5w3;['http://www.traileraddict.com/trailer/tetro/trailer', 'http://www.youtube.com/watch?v=XJ_XTIsMKig'];14/05/2009;Francis Ford Coppola;Vincent Gallo, Alden Ehrenreich, Maribel Verdú, Silvia Pérez;http://ia.media-imdb.com/images/M/MV5BMTY3ODQxNDc2Ml5BMl5BanBnXkFtZTcwOTYxMTYxMw@@._V1_SX300.jpg;['70116992'];127;7.8;Bennie travels to Buenos Aires to find his long-missing older brother, a once-promising writer who is now a remnant of his former self. Bennie's discovery of his brother's near-finished play might hold the answer to understanding their shared past and renewing their bond.;0;0;0;0;1;0;0;1;0;0;0;0;0.329545455;0
The 400 Blows;tt0053198;;;1959;François Truffaut;Jean-Pierre Léaud, Claire Maurier, Albert Rémy, Guy Decomble;http://ia.media-imdb.com/images/M/MV5BMTQzNTMzOTA2Ml5BMl5BanBnXkFtZTgwNDQ2OTI3MjE@._V1_.jpg;70048120;99;8.2;Intensely touching story of a misunderstood young adolescent who, left without attention, delves into a life of petty crime.;0;0;0;0;1;1;0;0;0;0;0;0;0.32;0
The Amazing Spider-Man;tt0948470;/m/0fqt1ns;['http://www.youtube.com/watch?v=DlM2CWNTQ84'];13/06/2012;Marc Webb;Andrew Garfield, Emma Stone, Rhys Ifans, Denis Leary;http://ia.media-imdb.com/images/M/MV5BMjMyOTM4MDMxNV5BMl5BanBnXkFtZTcwNjIyNzExOA@@._V1_SX300.jpg;['70208599'];136;7.3;After Peter Parker is bitten by a genetically altered spider, he gains newfound, spider-like powers and ventures out to solve the mystery of his parent's mysterious death.;1;1;0;0;1;0;1;0;0;1;1;0.758974359;0.397727273;0.686192469
The Apartment;tt0053604;;;1960;Billy Wilder;Jack Lemmon, Shirley MacLaine, Fred MacMurray, Ray Walston;http://ia.media-imdb.com/images/M/MV5BMTM1OTc4MzgzNl5BMl5BanBnXkFtZTcwNTE2NjgyMw@@._V1_.jpg;60011007;125;8.4;A man tries to rise in his company by letting its executives use his apartment for trysts, but complications and a romance of his own ensue.;0;0;0;1;1;0;0;0;1;0;0;0.02;0.98;0
The Avengers;tt0848228;;http://video-http.media-imdb.com/MV5BMjE0NjU2NDE3MF5BMTFeQW1wNF5BbWU3MDE4OTg1MDg@.mp4?Expires=1422398097&Signature=mBsrmU4WtfCShRW0-gsLazXpRUSck7IwAgk6L-oMHw3zupnGhhplDAy7pMQrs8qKNfZbhLcis080svMBL~0RRxiP4RFnxuna1otxEj9LLDgxiQEUmHkU0cDe3rz1txF1d4CDVaUoj2YjMUwQjGHrdmCL~-vYZVqvkkqmEj1Y0f8_&Key-Pair-Id=APKAILW5I44IHKUN2DYA;2012;Joss Whedon;Robert Downey Jr., Chris Evans, Mark Ruffalo, Chris Hemsworth;http://ia.media-imdb.com/images/M/MV5BMTk2NTI1MTU4N15BMl5BanBnXkFtZTcwODg0OTY0Nw@@._V1_.jpg;;143;8.2;Earth's mightiest heroes must come together and learn to fight as a team if they are to stop the mischievous Loki and his alien army from enslaving humanity.;1;0;0;0;0;0;1;0;0;1;1;0.68034188;0.005681818;0.707112971
The Baby;tt0069754;/m/04j32_w;[];1973;Ted Post;Anjanette Comer, Ruth Roman, Marianna Hill, Susanne Zenor;http://ia.media-imdb.com/images/M/MV5BMTQyOTQzMjgwM15BMl5BanBnXkFtZTgwNTIxOTkzMTE@._V1_SX300.jpg;['268995'];88;2.9;A social worker who recently lost her husband investigates the strange Wadsworth family. The Wadsworths might not seem too unusual to hear about them at first - consisting of the mother, ...;0;0;0;0;0;0;0;0;0;0;1;0.003418803;0;0.874476987
The Bad Mother's Handbook;tt0909010;/m/0crwqwj;[];19/02/2007;Robin Sheppard;Catherine Tate, Anne Reid, Holliday Grainger, Steve John Shepherd;http://ia.media-imdb.com/images/M/MV5BMTM0NTc1OTczNl5BMl5BanBnXkFtZTcwMzk5OTg5NA@@._V1_SX300.jpg;['70141500'];71;6.5;Karen Cooper wants to domineer her family and believes she's its pillar. In fact she does everything wrong. Thus she messes up all their lives and futures, rather then help her loved-ones.;0;0;0;1;1;0;0;0;1;0;0;0.032478632;0.988636364;0
The Bandit;tt0116231;;;1996;Yavuz Turgul;Sener Sen, Ugur Yücel, Sermin Hürmeric, Yesim Salkim;http://ia.media-imdb.com/images/M/MV5BNTQ2NTE5NDUwN15BMl5BanBnXkFtZTcwMTI5NjkzMQ@@._V1_.jpg;;128;8.7;The epic adventures of the legendary Baran the Bandit following his release from prison. After serving 35 years, it is no surprise that the world has changed dramatically. Still, Baran ...;0;0;0;0;1;0;0;0;0;0;1;0;0.32;0
The Battle of Algiers;tt0058946;;http://video-http.media-imdb.com/MV5BMjM1NDE5OTY5OV5BMTFeQW1wNF5BbWU4MDEwODEwOTIx.mp4?Expires=1422400503&Signature=R1INgErqtBj97oTbl5CN2Cc8EgXvZpcDalsJw6ywHKoVnDyGiU9RI8HHyDznv5C5HxNkbpERKJutBYHYEl4FYtHaB45hP~P7p5iZm06t3No3OA8U63s-EVAhFq5DnrOuHAbQpFcRpII0TCPPkIOYMvBt7wF~2Xb2CV7~MyLU5mg_&Key-Pair-Id=APKAILW5I44IHKUN2DYA;1966;Gillo Pontecorvo;Brahim Hadjadj, Jean Martin, Yacef Saadi, Samia Kerbash;http://ia.media-imdb.com/images/M/MV5BMTIzMjI1OTQxNV5BMl5BanBnXkFtZTcwMzc3NTYyMQ@@._V1_.jpg;60011023;121;8.2;In the 1950s, fear and violence escalate as the people of Algiers fight for independence from the French government.;0;0;0;0;1;0;0;0;0;0;0;0;0.31;0
The Best Years of Our Lives;tt0036868;;http://www.totaleclips.com/Player/Bounce.aspx?eclipid=e13141&bitrateid=471&vendorid=102&type=.mp4;1946;William Wyler;Myrna Loy, Fredric March, Dana Andrews, Teresa Wright;http://ia.media-imdb.com/images/M/MV5BMTk1NTAxNzg3Nl5BMl5BanBnXkFtZTcwNjU4OTQwNw@@._V1_.jpg;299970;172;8.2;Three WWII veterans return home to small-town America to discover that they and their families have been irreparably changed.;0;0;0;0;1;0;0;0;0;0;0;0;0.31;0
The Big Lebowski;tt0118715;;http://www.totaleclips.com/Player/Bounce.aspx?eclipid=e10236&bitrateid=471&vendorid=102&type=.mp4;1998;Joel Coen, Ethan Coen;Jeff Bridges, John Goodman, Julianne Moore, Steve Buscemi;http://ia.media-imdb.com/images/M/MV5BMTQ0NjUzMDMyOF5BMl5BanBnXkFtZTgwODA1OTU0MDE@._V1_.jpg;1181532;117;8.2;"""The Dude"" Lebowski, mistaken for a millionaire Lebowski, seeks restitution for his ruined rug and enlists his bowling buddies to help get it.";0;0;0;1;0;0;0;0;0;0;0;0;0.59;0
The Big Sleep;tt0038355;;http://www.totaleclips.com/Player/Bounce.aspx?eclipid=e17485&bitrateid=471&vendorid=102&type=.mp4;1946;Howard Hawks;Humphrey Bogart, Lauren Bacall, John Ridgely, Martha Vickers;http://ia.media-imdb.com/images/M/MV5BNjg5MjM5MzY5M15BMl5BanBnXkFtZTgwNjg3MzgyMjE@._V1_.jpg;305718;114;8.1;Private detective Philip Marlowe is hired by a rich family. Before the complex case is over, he's seen murder, blackmail, and what might be love.;0;0;0;0;0;0;0;1;0;0;1;0.01;0;0.91
The Big Year;tt1053810;/m/0gg91k7;[];14/10/2011;David Frankel;John Cleese, Jack Black, Zahf Paroo, Stacey Scowley;http://ia.media-imdb.com/images/M/MV5BMTc0MzcwMDcyOV5BMl5BanBnXkFtZTcwNTUwMjk1Ng@@._V1_SX300.jpg;['70178617'];100;5.3;Two bird enthusiasts try to defeat the cocky, cutthroat world record holder in a year-long bird-spotting competition.;0;0;0;1;0;0;0;0;0;0;0;0;0.585227273;0
The Blind Side;tt0878804;/m/05zy3sc;['http://www.youtube.com/watch?v=L6U1xbO2yaE'];17/11/2009;John Lee Hancock;Sandra Bullock, Tim McGraw, Quinton Aaron, Jae Head;http://ia.media-imdb.com/images/M/MV5BMjEzOTE3ODM3OF5BMl5BanBnXkFtZTcwMzYyODI4Mg@@._V1_SX300.jpg;['70119811'];129;8.3;The story of Michael Oher, a homeless and traumatized boy who became an All American football player and first round NFL draft pick with the help of a caring woman and her family.;0;0;0;0;1;0;0;0;0;0;0;0;0.306818182;0
The Bodyguard;tt0103855;/m/0258dh;[];25/11/1992;Mick Jackson;Kevin Costner, Whitney Houston, Gary Kemp, Bill Cobbs;http://ia.media-imdb.com/images/M/MV5BMTYxMTc4NDc2N15BMl5BanBnXkFtZTYwNTYxMzA5._V1_SX300.jpg;['321652'];129;5.5;A former Secret Service agent takes on the job of bodyguard to a pop singer, whose lifestyle is most unlike a President's.;0;0;0;0;1;0;0;0;1;0;1;0.030769231;0.397727273;0.326359833
The Bourne Ultimatum;tt0440963;;http://www.totaleclips.com/Player/Bounce.aspx?eclipid=e35523&bitrateid=472&vendorid=102&type=.mp4;2007;Paul Greengrass;Matt Damon, Julia Stiles, David Strathairn, Scott Glenn;http://ia.media-imdb.com/images/M/MV5BMTgzNjMwOTM3N15BMl5BanBnXkFtZTcwMzA5MDY0MQ@@._V1_.jpg;70058031;115;8.1;Jason Bourne dodges a ruthless CIA official and his agents from a new assassination program while searching for the origins of his life as a trained killer.;1;0;0;0;0;0;0;0;0;0;1;0.3;0;0.69
The Box;tt0362478;/m/07jwy4;[];17/09/2009;Richard Kelly;Cameron Diaz, James Marsden, Frank Langella, James Rebhorn;http://ia.media-imdb.com/images/M/MV5BMTI4MDA5NjIwM15BMl5BanBnXkFtZTcwNTA2MjY0Mg@@._V1_SX300.jpg;['70011979', '70108017'];115;4.5;A small wooden box arrives on the doorstep of a married couple, who know that opening it will grant them a million dollars and kill someone they don't know.;0;0;0;0;1;0;0;1;0;1;1;0.097435897;0.335227273;0.949790795
The Bridge;tt0052654;/m/04y5ksr;['http://www.youtube.com/watch?v=uecjvBaF_Oo'];22/10/1959;Bernhard Wicki;Folker Bohnet, Fritz Wepper, Michael Hinz, Frank Glaubrecht;http://ia.media-imdb.com/images/M/MV5BMTk3MjQxMjA0OF5BMl5BanBnXkFtZTcwMzk2NDIyMQ@@._V1_SX300.jpg;[];103;6.4;In 1945, Germany is being overrun, and nobody is left to fight but teenagers.;0;0;0;0;1;0;0;0;0;0;0;0;0.306818182;0
The Bridge on the River Kwai;tt0050212;;http://video-http.media-imdb.com/MV5BNzljMWMxOGItZDUwOS00YTcxLTkxNzEtZGNlNmU2Y2E5ZDQ1XkExMV5BbXA0XkFpbWRiLWV0cy10cmFuc2NvZGU@.mp4?Expires=1422388040&Signature=Cckofdv1MBJJEN-TiQ4JUmxZc9EGOEADEFZyuLbMZaS87c~K6fvb5x~vW56RnPl47Tyjk4DvfEF46FrmqGVlsg~HkfqIzSeWYtcVrG2ZH8KUJmvRzFjJr07MvBjktNYAkLYT7kdenI9w20~q-CvmFrydCo6q6dgOrka88vRJ-3g_&Key-Pair-Id=APKAILW5I44IHKUN2DYA;1957;David Lean;William Holden, Alec Guinness, Jack Hawkins, Sessue Hayakawa;http://ia.media-imdb.com/images/M/MV5BMTc2NzA0NTEwNF5BMl5BanBnXkFtZTcwMzA0MTk3OA@@._V1_.jpg;60002970;161;8.3;After settling his differences with a Japanese PoW camp commander, a British colonel co-operates to oversee his men's construction of a railway bridge for their captors - while oblivious to a plan by the Allies to destroy it.;0;1;0;0;1;0;0;0;0;0;0;0;0.34;0
The Broken;tt0906734;/m/02q7kzd;['http://www.youtube.com/embed/_ypL5Wc_5rY', 'http://www.youtube.com/watch?v=U8AmM54kf1M'];18/01/2008;Sean Ellis;Lena Headey, Ulrich Thomsen, Melvil Poupaud, Michelle Duncan;http://ia.media-imdb.com/images/M/MV5BNTc2MzM0MDI1Ml5BMl5BanBnXkFtZTcwMTA4MDYyMg@@._V1_SX300.jpg;['70084254'];91;3.9;In London, the radiologist Gina McVey organizes a surprise birthday party to her father John McVey with her boyfriend Stefan Chambers, her brother Daniel McVey and his girlfriend Kate ...;0;0;0;0;0;0;0;0;0;1;1;0.148717949;0.011363636;0.786610879
The Cake Eaters;tt0418586;/m/05p5m5f;[];2007;Mary Stuart Masterson;Elizabeth Ashley, Jayce Bartok, Bruce Dern, Miriam Shor;http://ia.media-imdb.com/images/M/MV5BNjU5NzY2MTk1NV5BMl5BanBnXkFtZTcwNTI3MjY2Mg@@._V1_SX300.jpg;['70069204'];86;6;Two families are brought together by the return of one family's son -- a reunion that conjures up old ghosts and issues that must be addressed.;0;0;0;0;1;0;0;0;1;0;0;0;0.340909091;0
The Cat;tt0066906;/m/0bh7w89;[];24/04/1971;Pierre Granier-Deferre;Jean Gabin, Simone Signoret, Annie Cordy, Jacques Rispal;http://ia.media-imdb.com/images/M/MV5BMTYwODIzMTk5OV5BMl5BanBnXkFtZTcwNDk3NjQ3MQ@@._V1_SX300.jpg;[];118;4.3;Courbevoie (France), 1971. Julien Bouin, a former typographist, and his wife Clemence, who used to perform in a circus, hardly talk to each other in their small house, soon to be demolished...;0;0;0;0;1;0;0;0;0;0;0;0;0.306818182;0
The Celebration;tt0154420;;http://www.totaleclips.com/Player/Bounce.aspx?eclipid=e11620&bitrateid=471&vendorid=102&type=.mp4;1998;Thomas Vinterberg;Ulrich Thomsen, Henning Moritzen, Thomas Bo Larsen, Paprika Steen;http://ia.media-imdb.com/images/M/MV5BMjYzMTYwNTIyMV5BMl5BanBnXkFtZTcwOTU2MjM2NQ@@._V1_.jpg;60035000;105;8.1;At Helge's 60th birthday party, some unpleasant family truths are revealed.;0;0;0;0;1;0;0;0;0;0;0;0;0.31;0
The Cell;tt0209958;/m/0315w4;[];17/08/2000;Tarsem Singh;Jennifer Lopez, Colton James, Dylan Baker, Marianne Jean-Baptiste;http://ia.media-imdb.com/images/M/MV5BMTQ3MzM4Mzc1NV5BMl5BanBnXkFtZTgwMjIxNzQxMTE@._V1_SX300.jpg;['60001368'];107;4.4;An FBI agent persuades a social worker, who is adept with a new experimental technology, to enter the mind of a comatose serial killer in order to learn where he has hidden his latest kidnap victim.;0;0;0;0;0;0;1;0;0;1;1;0.41025641;0.011363636;0.937238494
The Clinic;tt1345772;/m/0gjdzrd;['http://www.traileraddict.com/trailer/the-clinic/trailer'];25/07/2010;James Rabbitts;Tabrett Bethell, Freya Stafford, Andy Whitfield, Clare Bowen;http://ia.media-imdb.com/images/M/MV5BMTkwMzUwMjQ5NV5BMl5BanBnXkFtZTcwOTMyMzY2Mw@@._V1_SX300.jpg;['70190902'];94;6.1;While traveling across country with her fiancé, Beth wakes alone in an isolated clinic to a mother's worst nightmare. Just how far will she go to save her child?;0;0;0;0;0;0;0;0;0;0;1;0.003418803;0;0.874476987
The Code;tt0304391;/m/0513t8t;['http://www.metacritic.com/movie/the-code/trailers'];23/10/2002;Manuel Boursinhac;Samuel Le Bihan, Samy Naceri, Clotilde Courau, Marie Guillard;http://ia.media-imdb.com/images/M/MV5BMTg1NjE1NTg3Nl5BMl5BanBnXkFtZTcwNDkzMzUyMQ@@._V1_SX300.jpg;[];116;4.1;Dris is an ex-con, living in the borderline between a decent and a criminal life. He has a regular and simple work and lives a simple life with his wife Lise and loves his family. However, ...;1;0;0;0;1;0;0;0;0;0;1;0.061538462;0.329545455;0
The Crazies;tt0455407;/m/05zy8v6;[];23/02/2010;Breck Eisner;Timothy Olyphant, Radha Mitchell, Joe Anderson, Danielle Panabaker;http://ia.media-imdb.com/images/M/MV5BMjAzMDU5OTg0NV5BMl5BanBnXkFtZTcwNDQ4MjcwMw@@._V1_SX300.jpg;['70111794'];101;5.5;About the inhabitants of a small Iowa town suddenly plagued by insanity and then death after a mysterious toxin contaminates their water supply.;0;0;0;0;0;0;0;1;0;0;1;0.008547009;0;0.912133891
The Dark Hour;tt0484273;/m/040559q;[];06/10/2006;Elio Quiroga;Silke, Omar Muñoz, Pepo Oliva, Carola Manzanares;http://ia.media-imdb.com/images/M/MV5BMTIwNzYzNTM4NF5BMl5BanBnXkFtZTcwMzU2ODM0MQ@@._V1_SX300.jpg;['70123924'];92;3.5;"The eight years boy Jesús has been living in a crumbling underground facility since he was born with eight survivors of an apocalyptical war: the leader Maria and her lover Pablo; the gays ...";0;0;0;0;0;0;0;0;0;1;1;0.148717949;0.011363636;0.786610879
The Dark Knight;tt0468569;;http://www.totaleclips.com/Player/Bounce.aspx?eclipid=e43433&bitrateid=472&vendorid=102&type=.mp4;2008;Christopher Nolan;Christian Bale, Heath Ledger, Aaron Eckhart, Michael Caine;http://ia.media-imdb.com/images/M/MV5BMTMxNTMwODM0NF5BMl5BanBnXkFtZTcwODAyMTk2Mw@@._V1_.jpg;70079583;152;9;When the menace known as the Joker wreaks havoc and chaos on the people of Gotham, the caped crusader must come to terms with one of the greatest psychological tests of his ability to fight injustice.;1;1;0;0;1;0;0;0;0;0;1;0.47;0.35;0.5
